title,description,url,folder,tags,created,cover,highlights
Snopes.com,"The definitive Internet reference source for urban legends, folklore, myths, rumors, and misinformation.",https://www.snopes.com,BOOKMRKS-MTHRFCKR / REFERENCE-MTHRFCKR / EDU,edu,"September 14, 2022 12:49 PM (UTC)",https://mediaproxy.snopes.com/width/1200/https://www.snopes.com/tachyon/2019/11/2019-snopes-open-graph-default.png,
Science Forums,,https://www.scienceforums.net,BOOKMRKS-MTHRFCKR / REFERENCE-MTHRFCKR / EDU,edu,"September 14, 2022 12:49 PM (UTC)",,
Saylor Academy Open Textbooks | Saylor Academy,"Saylor Academy Open Textbooks We’re about so much more than just these textbooks. Students: We have almost 100 free, full-length certificate courses ready for you to take right now. Many of our courses can connect to zero-tuition college credit through our dozens of partner colleges and universities. Educators: Want more resources for your classroom? Saylor [...]Read More... from Saylor Academy Open Textbooks",https://www.saylor.org/books,BOOKMRKS-MTHRFCKR / REFERENCE-MTHRFCKR / EDU,edu,"September 14, 2022 12:49 PM (UTC)",https://resources.saylor.org/wwwresources/wp-content/uploads/20210302112211/Default-1200x1200-1.png,
tools-misc - freemediaheckyeah,r/FREEMEDIAHECKYEAH: 🍿 📺 🎵 🎮 📗 📱,https://www.reddit.com/r/freemediaheckyeah/wiki/tools-misc#wiki_.25b7_language_learning,BOOKMRKS-MTHRFCKR / REFERENCE-MTHRFCKR / EDU,edu,"September 14, 2022 12:49 PM (UTC)",,
PDFiles.Net | الموقع العربي الأول لتحميل الكتب التقنية,موقع تحميل كتب pdf يضم الكثير من الكتب الإلكترونية pdf بالعربية والإنكليزية لمراجع تقنية مميزة,https://www.pdfiles.net,BOOKMRKS-MTHRFCKR / REFERENCE-MTHRFCKR / EDU,edu,"September 14, 2022 12:49 PM (UTC)",https://www.pdfiles.net/assets/images/favicon/favicon.png,
PDF Books Library To download free eBooks,"PDF Books World offers free eBooks on fiction, non-fiction, academic, textbooks and children's categories for download online in high quality PDF format.",https://www.pdfbooksworld.com,BOOKMRKS-MTHRFCKR / REFERENCE-MTHRFCKR / EDU,edu,"September 14, 2022 12:49 PM (UTC)",,
"OpenEdition: four platforms for electronic resources in the humanities and social sciences: OpenEdition Books, OpenEdition Journals, Hypotheses, Calenda","OpenEdition gathers OpenEdition Books, OpenEdition Journals, Hypotheses.org and Calenda, four platforms dedicated to electronic resources in the humanities and social sciences. OpenEdition est un portail de ressources électroniques en sciences humaines et sociales (OpenEdition Books, OpenEdition Journals, Hypothèses, Calenda).",https://www.openedition.org,BOOKMRKS-MTHRFCKR / REFERENCE-MTHRFCKR / EDU,edu,"September 14, 2022 12:49 PM (UTC)",,
Invite Application | My Anonamouse,,https://www.myanonamouse.net/inviteapp.php,BOOKMRKS-MTHRFCKR / REFERENCE-MTHRFCKR / EDU,edu,"September 14, 2022 12:49 PM (UTC)",,
Login | My Anonamouse,,https://www.myanonamouse.net,BOOKMRKS-MTHRFCKR / REFERENCE-MTHRFCKR / EDU,edu,"September 14, 2022 12:49 PM (UTC)",,
https://www.metmuseum.org/art/metpublications/titles-with-full-text-online,,https://www.metmuseum.org/art/metpublications/titles-with-full-text-online,BOOKMRKS-MTHRFCKR / REFERENCE-MTHRFCKR / EDU,edu,"September 14, 2022 12:49 PM (UTC)",,
medRxiv,the preprint service for Health Sciences,https://www.medrxiv.org,BOOKMRKS-MTHRFCKR / REFERENCE-MTHRFCKR / EDU,edu,"September 14, 2022 12:49 PM (UTC)",,
The Ergonomic Development of Video Game Controllers,,https://www.longdom.org/open-access/the-ergonomic-development-of-video-game-controllers-2165-7556-1000209.pdf,BOOKMRKS-MTHRFCKR / REFERENCE-MTHRFCKR / EDU,edu,"September 14, 2022 12:49 PM (UTC)",,
JSTOR Home,"JSTOR is a digital library of academic journals, books, and primary sources.",https://www.jstor.org,BOOKMRKS-MTHRFCKR / REFERENCE-MTHRFCKR / EDU,edu,"September 14, 2022 12:49 PM (UTC)",,
"JEENEETBooks : Download Free IIT JEE, NEET Books PDF | Study Materials | MindMaps","Download Free IIT JEE (Main and Advanced), NEET Books PDF | Test Series | DPPs | Study Materials | Video Lectures | Coaching Modules | Rank Boosters |",https://www.jeeneetbooks.in,BOOKMRKS-MTHRFCKR / REFERENCE-MTHRFCKR / EDU,edu,"September 14, 2022 12:49 PM (UTC)",https://1.bp.blogspot.com/-EoybNVN9YBc/X8OaC-flN8I/AAAAAAAAQKE/D8hh3LGNlzM0bym6hdFUj5fOCQhRgtMoACNcBGAsYHQ/s0/fletro-img.png,
Intechopen,,https://www.intechopen.com,BOOKMRKS-MTHRFCKR / REFERENCE-MTHRFCKR / EDU,edu,"September 14, 2022 12:49 PM (UTC)",,
HowStuffWorks - Learn How Everything Works!,"HowStuffWorks explains thousands of topics, ranging from the flu to black holes to conspiracy theories, with video and illustrations so you can learn how everything works.",https://www.howstuffworks.com,BOOKMRKS-MTHRFCKR / REFERENCE-MTHRFCKR / EDU,edu,"September 14, 2022 12:49 PM (UTC)",https://cdn.hswstatic.com/gif/hsw-logo-120x90.jpg,
HathiTrust Digital Library | Millions of books online,,https://www.hathitrust.org,BOOKMRKS-MTHRFCKR / REFERENCE-MTHRFCKR / EDU,edu,"September 14, 2022 12:49 PM (UTC)",,
"Engineering Books PDF | Download Free Past Papers, PDF Notes, Manuals & Templates, we have 4382 Books & Templates for free |","Download Free Engineering PDF Books, Owner's Manual and Excel Templates, Word Templates PowerPoint Presentations",https://www.engineeringbookspdf.com,BOOKMRKS-MTHRFCKR / REFERENCE-MTHRFCKR / EDU,edu,"September 14, 2022 12:49 PM (UTC)",,
Directory of Open Access Books,,https://www.doabooks.org,BOOKMRKS-MTHRFCKR / REFERENCE-MTHRFCKR / EDU,edu,"September 14, 2022 12:49 PM (UTC)",http://doabooks.org/static-assets/images/layout/doablogo-banner.png,
Open Access Journals | De Gruyter,De Gruyter | 270 years of academic publishing,https://www.degruyter.com/page/2045,BOOKMRKS-MTHRFCKR / REFERENCE-MTHRFCKR / EDU,edu,"September 14, 2022 12:49 PM (UTC)",,
De Gruyter,"We’ve built this digital research platform to provide academics everywhere with fast, stable and secure digital access to our library of over 110,000 scholarly books and 800,000 journal articles. We’ve tested the platform in close cooperation with leading academic institutions. If you have any questions or you notice something doesn’t quite work as it should, please visit our Help/FAQ page and let us know.",https://www.degruyter.com/browse?access_4=open&pagesize=10&sort=datedescending&submittedfilterid=by-type&type_5=book,BOOKMRKS-MTHRFCKR / REFERENCE-MTHRFCKR / EDU,edu,"September 14, 2022 12:49 PM (UTC)",https://www.degruyter.com/assets/images/79e7015f26a7ae3ab6c1fcaa6863efdb-degruyter_logo_negativ.png,
CK12-Foundation,,https://www.ck12.org,BOOKMRKS-MTHRFCKR / REFERENCE-MTHRFCKR / EDU,edu,"September 14, 2022 12:49 PM (UTC)",,
Book Gold Mine,"Free e-books, lectures, notes and other documents in various subjects",https://www.bookgoldmine.com,BOOKMRKS-MTHRFCKR / REFERENCE-MTHRFCKR / EDU,edu,"September 14, 2022 12:49 PM (UTC)",https://www.bookgoldmine.com/Content/Images/Logo.gif,
bioRxiv,Welcome to the bioRxiv homepage.,https://www.biorxiv.org,BOOKMRKS-MTHRFCKR / REFERENCE-MTHRFCKR / EDU,edu,"September 14, 2022 12:49 PM (UTC)",,
https://www.apaonline.org/,,https://www.apaonline.org,BOOKMRKS-MTHRFCKR / REFERENCE-MTHRFCKR / EDU,edu,"September 14, 2022 12:49 PM (UTC)",,
https://www.allaboutcircuits.com/education/,,https://www.allaboutcircuits.com/education,BOOKMRKS-MTHRFCKR / REFERENCE-MTHRFCKR / EDU,edu,"September 14, 2022 12:49 PM (UTC)",,
My Knowledge Wiki | Everything I know,This is my personal wiki where I share everything I know about this world in form of an online wiki built with Docusaurus on GitHub.,https://wiki.nikiv.dev,BOOKMRKS-MTHRFCKR / REFERENCE-MTHRFCKR / EDU,edu,"September 14, 2022 12:49 PM (UTC)",,
Non-Fiction,Non-Fiction | VK,https://vk.com/non_fic,BOOKMRKS-MTHRFCKR / REFERENCE-MTHRFCKR / EDU,edu,"September 14, 2022 12:49 PM (UTC)","http://sun9-52.userapi.com/s/v1/if1/EhGT6IYcJRxaeXQDeVbr9x4Foky8RvYSfZ-ltlnBAHm5hpN8ky7SFmZry4C3nEmgxEMRN6c9.jpg?size=200x200&quality=96&crop=0,0,417,417&ava=1",
"E-book library. Search and download for free, instantly.",Our website have hundred thousands of free e-books and documents for students. All are free and downloadable.,https://vdoc.pub,BOOKMRKS-MTHRFCKR / REFERENCE-MTHRFCKR / EDU,edu,"September 14, 2022 12:49 PM (UTC)",https://vdoc.pub/static/img/og-image.png,
Welcome to OpenDOAR - v2.sherpa,,https://v2.sherpa.ac.uk/opendoar,BOOKMRKS-MTHRFCKR / REFERENCE-MTHRFCKR / EDU,edu,"September 14, 2022 12:49 PM (UTC)",,
Table of Contents,"A free, interactive book for electronics hobbyists and electrical engineering students: Practical Circuit Design and Analysis.",https://ultimateelectronicsbook.com,BOOKMRKS-MTHRFCKR / REFERENCE-MTHRFCKR / EDU,edu,"September 14, 2022 12:49 PM (UTC)",,
A collection of over 120 philosophy reading lists organised by topic - The Daily Idea,"One of the most common questions people ask when learning about philosophy is: “what should I read first?” Unfortunately, it can also be a difficult question to answer. Philosophy is an incredibly broad subject and there is no single starting point that will be best for everyone. The best place to start will depend heavily on your preferred learning style, the topics you’re interested in, and the amount of time and energy you’re willing to spend reading. Instead of recommending a single “best” starting point, these lists aim to provide ... Read More",https://thedailyidea.org/reading-lists,BOOKMRKS-MTHRFCKR / REFERENCE-MTHRFCKR / EDU,edu,"September 14, 2022 12:49 PM (UTC)",http://ws-na.amazon-adsystem.com/widgets/q?_encoding=UTF8&MarketPlace=US&ASIN=B07WHBQQ82&ServiceVersion=20070822&ID=AsinImage&WS=1&Format=_SL250_&tag=philosophyf09-20,
A Collection of 500+ Philosophy Course Syllabi Organised by Topic - The Daily Idea,A collection of over 500 philosophy course syllabi. Quickly find syllabi on over 100 different philosophical topics.,https://thedailyidea.org/philosophy-syllabi-collection,BOOKMRKS-MTHRFCKR / REFERENCE-MTHRFCKR / EDU,edu,"September 14, 2022 12:49 PM (UTC)",,
r/textbookrequest,r/textbookrequest: My goal for this subreddit is to have users post a request for a specific textbook and if you see a request that you have a pdf …,https://reddit.com/r/textbookrequest,BOOKMRKS-MTHRFCKR / REFERENCE-MTHRFCKR / EDU,edu,"September 14, 2022 12:49 PM (UTC)",,
r/textbookfinder,"r/textbookfinder: All the textbooks you need at great prices! For any new request, PM the moderator.",https://reddit.com/r/textbookfinder,BOOKMRKS-MTHRFCKR / REFERENCE-MTHRFCKR / EDU,edu,"September 14, 2022 12:49 PM (UTC)",,
r/textbook_piracy,r/textbook_piracy: This subreddit collects resources and links to pirated textbooks that are made available free of charge.,https://reddit.com/r/textbook_piracy,BOOKMRKS-MTHRFCKR / REFERENCE-MTHRFCKR / EDU,edu,"September 14, 2022 12:49 PM (UTC)",,
r/Scholar,r/Scholar: This subreddit is for requesting and sharing specific articles available in various databases.,https://reddit.com/r/scholar,BOOKMRKS-MTHRFCKR / REFERENCE-MTHRFCKR / EDU,edu,"September 14, 2022 12:49 PM (UTC)",https://b.thumbs.redditmedia.com/lmo96dzw-3cQrmUngwJ-HIVfHwYfoWWi9AVg6uw1NIQ.png,
r/mathbooks,r/mathbooks:,https://reddit.com/r/mathbooks,BOOKMRKS-MTHRFCKR / REFERENCE-MTHRFCKR / EDU,edu,"September 14, 2022 12:49 PM (UTC)",,
r/eebooks,r/eebooks: An archive of links to **published** electrical/computer engineering textbooks that have been released online for free by their …,https://reddit.com/r/eebooks,BOOKMRKS-MTHRFCKR / REFERENCE-MTHRFCKR / EDU,edu,"September 14, 2022 12:49 PM (UTC)",,
r/econbooks,r/econbooks:,https://reddit.com/r/econbooks,BOOKMRKS-MTHRFCKR / REFERENCE-MTHRFCKR / EDU,edu,"September 14, 2022 12:49 PM (UTC)",,
r/csbooks,r/csbooks:,https://reddit.com/r/csbooks,BOOKMRKS-MTHRFCKR / REFERENCE-MTHRFCKR / EDU,edu,"September 14, 2022 12:49 PM (UTC)",,
https://redd.it/smm6ib,,https://redd.it/smm6ib,BOOKMRKS-MTHRFCKR / REFERENCE-MTHRFCKR / EDU,edu,"September 14, 2022 12:49 PM (UTC)",,
"Free Math Resources - Textbooks, Lectures Notes, Videos and Online Courses","Discover incredible free resources to study mathematics - textbooks, lecture notes, video and online courses.",https://realnotcomplex.com,BOOKMRKS-MTHRFCKR / REFERENCE-MTHRFCKR / EDU,edu,"September 14, 2022 12:49 PM (UTC)",,
RationalWiki,,https://rationalwiki.org,BOOKMRKS-MTHRFCKR / REFERENCE-MTHRFCKR / EDU,edu,"September 14, 2022 12:49 PM (UTC)",https://rationalwiki.org/w/images/6/6e/Rw_logo.png,
Butterick’s Practical Typography,,https://practicaltypography.com,BOOKMRKS-MTHRFCKR / REFERENCE-MTHRFCKR / EDU,edu,"September 14, 2022 12:49 PM (UTC)",,
Group selection,,https://powerinbooks.xyz/temp,BOOKMRKS-MTHRFCKR / REFERENCE-MTHRFCKR / EDU,edu,"September 14, 2022 12:49 PM (UTC)",,
Home - PickPDFs,Latest posts Williams Gynecology 3rd Edition PDF Free Download Source Code Meditation PDF Free Download Edible and Medicinal Mushrooms PDF Free Download Chinese Medical Herbology & Pharmacology PDF Free Download Genetics Analysis and Principles 6th Edition PDF Oxford Handbook of Epidemiology for Clinicians PDF » Free PDF EPUB Medical Books Clinical Manual of Cultural Psychiatry …,https://pickpdfs.com,BOOKMRKS-MTHRFCKR / REFERENCE-MTHRFCKR / EDU,edu,"September 14, 2022 12:49 PM (UTC)",,
OpenStax | Free Textbooks Online with No Catch,"OpenStax offers free college textbooks for all types of students, making education accessible & affordable for everyone. Browse our list of available subjects!",https://openstax.org,BOOKMRKS-MTHRFCKR / REFERENCE-MTHRFCKR / EDU,edu,"September 14, 2022 12:49 PM (UTC)",https://assets.openstax.org/oscms-prodcms/media/images/Turning_textbook_highlighting_into_time_well-sp.original.jpg,
Open Textbook Library - Open Textbook Library,"Open textbooks are licensed by authors and publishers to be freely used and adapted. Download, edit and distribute them at no cost.",https://open.umn.edu/opentextbooks,BOOKMRKS-MTHRFCKR / REFERENCE-MTHRFCKR / EDU,edu,"September 14, 2022 12:49 PM (UTC)",,
Home,,https://open.bccampus.ca,BOOKMRKS-MTHRFCKR / REFERENCE-MTHRFCKR / EDU,edu,"September 14, 2022 12:49 PM (UTC)",,
The Online Books Page: Search,,https://onlinebooks.library.upenn.edu/search.html,BOOKMRKS-MTHRFCKR / REFERENCE-MTHRFCKR / EDU,edu,"September 14, 2022 12:49 PM (UTC)",,
The Online Books Page,,https://onlinebooks.library.upenn.edu,BOOKMRKS-MTHRFCKR / REFERENCE-MTHRFCKR / EDU,edu,"September 14, 2022 12:49 PM (UTC)",,
250+ Killer Digital Libraries and Archives | OEDB.org,OEDb.org has compiled a 2015 list of more than 250 digital libraries available across the country. Explore the free archives available in your state.,https://oedb.org/ilibrarian/250-plus-killer-digital-libraries-and-archives,BOOKMRKS-MTHRFCKR / REFERENCE-MTHRFCKR / EDU,edu,"September 14, 2022 12:49 PM (UTC)",https://oedb.org/wp-content/uploads/2014/01/photo-featured-default.png,
Online library and publication platform,,https://oapen.org,BOOKMRKS-MTHRFCKR / REFERENCE-MTHRFCKR / EDU,edu,"September 14, 2022 12:49 PM (UTC)",https://oapen.org/static-assets/images/oapenlogo-banner.png,
Monoskop Log,Digital library of arts and humanities,https://monoskop.org/log,BOOKMRKS-MTHRFCKR / REFERENCE-MTHRFCKR / EDU,edu,"September 14, 2022 12:49 PM (UTC)",,
Medical Study Zone,Guides And Notes For Medical Students,https://medicalstudyzone.com,BOOKMRKS-MTHRFCKR / REFERENCE-MTHRFCKR / EDU,edu,"September 14, 2022 12:49 PM (UTC)",,
The Ultimate Guide to Virtual Museum Resources | MCN,"Check our list (updated daily) to access to endless open content, educational resources for e-learning, and virtual retreats to art, culture, and history.",https://mcn.edu/a-guide-to-virtual-museum-resources,BOOKMRKS-MTHRFCKR / REFERENCE-MTHRFCKR / EDU,edu,"September 14, 2022 12:49 PM (UTC)",https://i2.wp.com/mcn.edu/wp-content/uploads/2020/02/mcn-denver-1-1024x547-1.jpg?fit=1024%2C547&ssl=1,
masterWiki,"Classes stolen from MasterClass, republished as wikiHow articles.",https://masterwiki.how,BOOKMRKS-MTHRFCKR / REFERENCE-MTHRFCKR / EDU,edu,"September 14, 2022 12:49 PM (UTC)",https://masterwiki.how/social/facebook.png,
Explanations,,https://magcius.github.io/xplain/article,BOOKMRKS-MTHRFCKR / REFERENCE-MTHRFCKR / EDU,edu,"September 14, 2022 12:49 PM (UTC)",,
JEE Books PDF,Welcome to my channel   In this channel I will upload PDF'S of Jee Mains And Advance Books  So be with me  Share and Like my video  And Subscribe my channel and hit bell icon for latest update Thanks     Join Our Telegram Group 👇  https://telegram.me/jeebookspdf     Join Our Facebook Page 👇  https://www.facebook.com/100010577709817/posts/911530005876248/?app=fbl    Follow On Instagram 👇  https://www.instagram.com/jeebookspdf/?hl=en,https://m.youtube.com/c/jeebookspdf,BOOKMRKS-MTHRFCKR / REFERENCE-MTHRFCKR / EDU,edu,"September 14, 2022 12:49 PM (UTC)",https://yt3.ggpht.com/ytc/AMLnZu8S60FzPcpA4ECJnngE7N4vZ8ytn4tnlfNgwirK=s900-c-k-c0x00ffffff-no-rj,
lolmythesis,,https://lolmythesis.com,BOOKMRKS-MTHRFCKR / REFERENCE-MTHRFCKR / EDU,edu,"September 14, 2022 12:49 PM (UTC)",https://64.media.tumblr.com/avatar_425249ac74e1_128.pnj,
Index of /,,https://lit.gfax.ch,BOOKMRKS-MTHRFCKR / REFERENCE-MTHRFCKR / EDU,edu,"September 14, 2022 12:49 PM (UTC)",,
https://link.springer.com/search?showall=false&query=&facet-content-type=%22book%22,,https://link.springer.com/search?facet-content-type=%22book%22&query=&showall=false,BOOKMRKS-MTHRFCKR / REFERENCE-MTHRFCKR / EDU,edu,"September 14, 2022 12:49 PM (UTC)",,
libribook | Free Read & Download Online Books,"Read online books and download pdfs for free of programming and IT ebooks, business ebooks, science and maths, medical and medicine ebooks at libribook.",https://libribook.com,BOOKMRKS-MTHRFCKR / REFERENCE-MTHRFCKR / EDU,edu,"September 14, 2022 12:49 PM (UTC)",https://libribook.com/Content/images/logo.jpg,
LibreTexts - Free The Textbook,LibreTexts is developing the next generation of open-access texts. Open. Free. Accessible to all.,https://libretexts.org,BOOKMRKS-MTHRFCKR / REFERENCE-MTHRFCKR / EDU,edu,"September 14, 2022 12:49 PM (UTC)",,
Memory of the World Library,,https://library.memoryoftheworld.org/#/books/,BOOKMRKS-MTHRFCKR / REFERENCE-MTHRFCKR / EDU,edu,"September 14, 2022 12:49 PM (UTC)",,
Lib Ebooks » Free PDF EPUB Books,"Download EBooks For free : Lib Ebooks Website Provides Free PDF Books and more.. For all, In many different Subjects: Dentistry, Anatomy,...",https://lib-ebooks.com,BOOKMRKS-MTHRFCKR / REFERENCE-MTHRFCKR / EDU,edu,"September 14, 2022 12:49 PM (UTC)",https://b6t4d8w4.rocketcdn.me/wp-content/uploads/2019/08/Library-Ebooks-Free.png,
learncreative - IIT JEE NEET Materials & Engineering Notes,"Free download - Mechanical, Electrical, Electronics and Civil Engineering Notes ,handwritten notes, exam not, previous year questions,IITJEE Study materials",https://learncreative.net,BOOKMRKS-MTHRFCKR / REFERENCE-MTHRFCKR / EDU,edu,"September 14, 2022 12:49 PM (UTC)",,
Saylor Academy | Saylor Academy,Build new skills or work towards a degree at your own pace with free Saylor Academy college courses.,https://learn.saylor.org,BOOKMRKS-MTHRFCKR / REFERENCE-MTHRFCKR / EDU,edu,"September 14, 2022 12:49 PM (UTC)",https://resources.saylor.org/og/default-1200x1200.png,
"Free Information Technology Research Library of White Papers, Magazines, Reports, and eBooks","#1 Resource for Free Information Technology Research, White Papers, Case Studies, Magazines, and eBooks",https://knowfree.tradepub.com,BOOKMRKS-MTHRFCKR / REFERENCE-MTHRFCKR / EDU,edu,"September 14, 2022 12:49 PM (UTC)",https://img.tradepub.com/free/@@pubcode@@/images/@@pubcode@@c8w.jpg,
"1,000+ FREE Online Textbook Library & Learning Resources for All Subjects","Tired of ridiculously expensive textbooks? ✅ Here you'll find over 1,000 free open source online textbooks for all subjects.",https://ivypanda.com/blog/1000-open-textbooks-and-learning-resources-for-all-subjects,BOOKMRKS-MTHRFCKR / REFERENCE-MTHRFCKR / EDU,edu,"September 14, 2022 12:49 PM (UTC)",https://ivypanda.com/blog/wp-content/uploads/2016/06/old-university-library-faculty-geography-history.jpg,
The Bash Guide,A complete guide for newcomers and advanced users to correct usage and deep understanding of the bash shell language.,https://guide.bash.academy,BOOKMRKS-MTHRFCKR / REFERENCE-MTHRFCKR / EDU,edu,"September 14, 2022 12:49 PM (UTC)",,
"GitHub - owainlewis/awesome-artificial-intelligence: A curated list of Artificial Intelligence (AI) courses, books, video lectures and papers.","A curated list of Artificial Intelligence (AI) courses, books, video lectures and papers. - GitHub - owainlewis/awesome-artificial-intelligence: A curated list of Artificial Intelligence (AI) cours...",https://github.com/owainlewis/awesome-artificial-intelligence#free-content,BOOKMRKS-MTHRFCKR / REFERENCE-MTHRFCKR / EDU,edu,"September 14, 2022 12:49 PM (UTC)",https://opengraph.githubassets.com/2b424bd80f789a1247210ce8f4dada5e7c7a2615a8fd97956a32cfa947b51f54/owainlewis/awesome-artificial-intelligence,
"GitHub - mytechnotalent/Reverse-Engineering: A FREE comprehensive reverse engineering tutorial covering x86, x64, 32-bit ARM & 64-bit ARM architectures.","A FREE comprehensive reverse engineering tutorial covering x86, x64, 32-bit ARM & 64-bit ARM architectures. - GitHub - mytechnotalent/Reverse-Engineering: A FREE comprehensive reverse engin...",https://github.com/mytechnotalent/reverse-engineering-tutorial,BOOKMRKS-MTHRFCKR / REFERENCE-MTHRFCKR / EDU,edu,"September 14, 2022 12:49 PM (UTC)",https://opengraph.githubassets.com/bbd37d5f1160346d32b887e5815454ab2abf5b80ed090272225bfec53ecfa92e/mytechnotalent/Reverse-Engineering,
GitHub - learn-anything/books: Awesome Books,Awesome Books. Contribute to learn-anything/books development by creating an account on GitHub.,https://github.com/learn-anything/books,BOOKMRKS-MTHRFCKR / REFERENCE-MTHRFCKR / EDU,edu,"September 14, 2022 12:49 PM (UTC)",https://opengraph.githubassets.com/c8979ab11ac68b6c7a20c3e10184164772e90a5963a7058833c1b4fdee0345e6/learn-anything/books,
Free PLR Downloads | Download Free PLR & MRR Products,"Download Free PLR and MRR Products Now! Instant Download, Unlimited Download, No Sign Up and No BS! Free eBooks, Articles, Software, Videos and Many More!",https://freeplrdownloads.com,BOOKMRKS-MTHRFCKR / REFERENCE-MTHRFCKR / EDU,edu,"September 14, 2022 12:49 PM (UTC)",,
Free math resources,,https://free-math-resources.netlify.app,BOOKMRKS-MTHRFCKR / REFERENCE-MTHRFCKR / EDU,edu,"September 14, 2022 12:49 PM (UTC)",,
Free Astronomy Resources,,https://er-cryptid.tumblr.com/post/176809097526/free-astronomy-resources,BOOKMRKS-MTHRFCKR / REFERENCE-MTHRFCKR / EDU,edu,"September 14, 2022 12:49 PM (UTC)",,
Wikibooks,,https://en.wikibooks.org,BOOKMRKS-MTHRFCKR / REFERENCE-MTHRFCKR / EDU,edu,"September 14, 2022 12:49 PM (UTC)",,
Education Books,Free Education Books give you various of free ebooks that you can download to support your study.,https://edubookpdf.com,BOOKMRKS-MTHRFCKR / REFERENCE-MTHRFCKR / EDU,edu,"September 14, 2022 12:49 PM (UTC)",,
EasyEngineering Networks – An Online Educational Portal,"🎇 Are You Searching for a Job (New Job Website)  - To Get Daily updates of Govt Jobs & Teaching Jobs 🎊 					 			Ad		 			 List of Upcoming Govt & Faculty Jobs, Events Entire PDF - Lastly",https://easyengineering.net,BOOKMRKS-MTHRFCKR / REFERENCE-MTHRFCKR / EDU,edu,"September 14, 2022 12:49 PM (UTC)",https://i0.wp.com/easyengineering.net/wp-content/uploads/2018/02/imageedit_59_6308991037.png?fit=512%2C512&ssl=1,
Dl,,https://dl.acm.org,BOOKMRKS-MTHRFCKR / REFERENCE-MTHRFCKR / EDU,edu,"September 14, 2022 12:49 PM (UTC)",,
Discord - A New Way to Chat with Friends & Communities,"Discord is the easiest way to communicate over voice, video, and text.  Chat, hang out, and stay close with your friends and communities.",https://discord.gg/v23httx,BOOKMRKS-MTHRFCKR / REFERENCE-MTHRFCKR / EDU,edu,"September 14, 2022 12:49 PM (UTC)",https://discord.com/invite/undefined//discord.com/assets/652f40427e1f5186ad54836074898279.png,
https://cse.google.com/cse/publicurl?cx=011394183039475424659:5bfyqg89ers,,https://cse.google.com/cse/publicurl?cx=011394183039475424659%3A5bfyqg89ers,BOOKMRKS-MTHRFCKR / REFERENCE-MTHRFCKR / EDU,edu,"September 14, 2022 12:49 PM (UTC)",,
https://cse.google.com/cse?cx=001639227550064093264:dznewka3cca,,https://cse.google.com/cse?cx=001639227550064093264%3Adznewka3cca,BOOKMRKS-MTHRFCKR / REFERENCE-MTHRFCKR / EDU,edu,"September 14, 2022 12:49 PM (UTC)",,
Brill | Over three centuries of scholarly publishing,"Founded in 1683 in Leiden, the Netherlands, Brill is a leading international academic publisher in the Humanities, Social Sciences, International Law, and Biology. With offices in the Netherlands, Germany, Austria, the USA and Asia, Brill today publishes more than 360 journals and 2,000 new books and reference works each year as well as a large number of databases and primary source research collections.",https://brill.com,BOOKMRKS-MTHRFCKR / REFERENCE-MTHRFCKR / EDU,edu,"September 14, 2022 12:49 PM (UTC)",https://brill.com/fileasset/fileasset/appbar/logo-brill-300x100-transparent-desktop.png,
arXiv.org e-Print archive,,https://arxiv.org,BOOKMRKS-MTHRFCKR / REFERENCE-MTHRFCKR / EDU,edu,"September 14, 2022 12:49 PM (UTC)",,
Free Medical Books,"Download the Medical Book : Am-medicine Website Provides Free Medical Books PDF For all, In many different Subjects: Dentistry, Anatomy..",https://am-medicine.com,BOOKMRKS-MTHRFCKR / REFERENCE-MTHRFCKR / EDU,edu,"September 14, 2022 12:49 PM (UTC)",https://am-medicine.com/wp-content/uploads/2014/02/new-am-medicine.png,
Allitebooks,Download Free IT E-books,https://allitebook.xyz,BOOKMRKS-MTHRFCKR / REFERENCE-MTHRFCKR / EDU,edu,"September 14, 2022 12:49 PM (UTC)",,
