title,description,url,folder,tags,created,cover,highlights
tetw,,https://tetw.org,BOOKMRKS-MTHRFCKR / REFERENCE-MTHRFCKR / DocArticles,doc articles,"September 14, 2022 12:49 PM (UTC)",https://64.media.tumblr.com/avatar_d16be96237f7_128.pnj,
Sci-Hub,Официальный бот сервиса Sci-Hub. Бесплатный доступ к научным публикациям. Sci-Hub bot. Break academic paywalls,https://t.me/scihubot,BOOKMRKS-MTHRFCKR / REFERENCE-MTHRFCKR / DocArticles,doc articles,"September 14, 2022 12:49 PM (UTC)",https://cdn4.telegram-cdn.org/file/DX0uSwLdc6-n7w_hg6AJ3dIfbIQPHHntYILkmVFltnxJfMaJhh4Iv-l-4IAAbt1pt90O64BL0kFHBACzr729SQ7Yx-ETiEth82gTCphDgHZ4YtNIlI2Av9folzXWKs4BIWEWLOE4lmr7rLTJOLvs2RTGEQLoPZW9fRXvYDn7A-6ZNQLZVhp2krHJSSTS_yhuFva2uQWbp6PUq2npbuWwsl2axi7SJWtUysd6QwiOucr_-1OdffUCxDBE1ttc-gsirLmVV0mv76JrF3H7mrKYAMRHa2HjqagCKvrx9xHAA4ZaqLLeeBgZB6sOuyEnYxdleFm3p6bmORbhwCCkqSNBsQ.jpg,
Sci-Hub,Канал проекта Sci-Hub,https://t.me/freescience,BOOKMRKS-MTHRFCKR / REFERENCE-MTHRFCKR / DocArticles,doc articles,"September 14, 2022 12:49 PM (UTC)",https://cdn4.telegram-cdn.org/file/WPwLuDML-k067HqQPYtWNkrEuHySi0RUPkskgrb13bhexjUIkI-QUIbYOTze88BYwhKkTg16WQb1YEQob8ybNzJop0nwbDWYXIIzIlmS-9n2xAzrUYi7PG9J96vwv0UzChB4Uy96KfC8C9V9jtrJy35C5765lJeF43QNL4OLjIz4P88ddLjf8GyX9QpYn8A2HfS_N8FoZT6ItSrutbeOdcK0EQI7jH7hNwyNzsBIjyx0R_kehdGL8glulhvUZIq7w6hs9mNZWdPdstdXVBBsNatd-PoqCuTbYufykqCnSMlAGYCbJRbnoFj1j57dEnkK5lu-PLIP5IFQeCVEnPtMNg.jpg,
Sioyek,,https://sioyek.info,BOOKMRKS-MTHRFCKR / REFERENCE-MTHRFCKR / DocArticles,doc articles,"September 14, 2022 12:49 PM (UTC)",,
Share,,https://share.osf.io,BOOKMRKS-MTHRFCKR / REFERENCE-MTHRFCKR / DocArticles,doc articles,"September 14, 2022 12:49 PM (UTC)",,
Crossref Metadata Search,,https://search.crossref.org,BOOKMRKS-MTHRFCKR / REFERENCE-MTHRFCKR / DocArticles,doc articles,"September 14, 2022 12:49 PM (UTC)",,
Scinapse | Academic search engine for paper,Every research begins here. Find papers from over 170m papers in major STEM journals. Save time and never re-search.,https://scinapse.io,BOOKMRKS-MTHRFCKR / REFERENCE-MTHRFCKR / DocArticles,doc articles,"September 14, 2022 12:49 PM (UTC)",http://assets.pluto.network/scinapse/og_image.png,
https://scialert.net/,,https://scialert.net,BOOKMRKS-MTHRFCKR / REFERENCE-MTHRFCKR / DocArticles,doc articles,"September 14, 2022 12:49 PM (UTC)",,
"Sci-Hub: common ownership of the means of production,free access to articles of consumption","Sci-Hub website. Get free access to academic journals. Download research papers for free from ScienceDirect, IEEE, Wiley, Springer, Nature and others",https://sci-hub.se,BOOKMRKS-MTHRFCKR / REFERENCE-MTHRFCKR / DocArticles,doc articles,"September 14, 2022 12:49 PM (UTC)",,
Sci-Hub,"Sci-Hub,mg.scihub.ltd,sci-hub.tw,The project is supported by user donations. Imagine the world with free access to knowledge for everyone ‐ a world without any paywalls.",https://sci-hub.hkvisa.net,BOOKMRKS-MTHRFCKR / REFERENCE-MTHRFCKR / DocArticles,doc articles,"September 14, 2022 12:49 PM (UTC)",https://img.sci-hub.shop/scihub/logo.raven.jpg,
Google Scholar,"Google Scholar provides a simple way to broadly search for scholarly literature. Search across a wide variety of disciplines and sources: articles, theses, books, abstracts and court opinions.",https://scholar.google.com,BOOKMRKS-MTHRFCKR / REFERENCE-MTHRFCKR / DocArticles,doc articles,"September 14, 2022 12:49 PM (UTC)",,
Internet Archive Scholar,,https://scholar.archive.org,BOOKMRKS-MTHRFCKR / REFERENCE-MTHRFCKR / DocArticles,doc articles,"September 14, 2022 12:49 PM (UTC)",,
Zenk - Security - Repository,,https://repo.zenk-security.com,BOOKMRKS-MTHRFCKR / REFERENCE-MTHRFCKR / DocArticles,doc articles,"September 14, 2022 12:49 PM (UTC)",,
r/scihub,r/scihub: The first pirate website in the world to provide mass and public access to tens of millions of research papers. /r/scihub and its …,https://reddit.com/r/scihub,BOOKMRKS-MTHRFCKR / REFERENCE-MTHRFCKR / DocArticles,doc articles,"September 14, 2022 12:49 PM (UTC)",https://styles.redditmedia.com/t5_3cghs/styles/communityIcon_ydpoa9d8zbc51.png?width=256&s=385710f14e3ffddb9967f499a1e6f348def2dfe4,
https://redd.it/edwi9b,,https://redd.it/edwi9b,BOOKMRKS-MTHRFCKR / REFERENCE-MTHRFCKR / DocArticles,doc articles,"September 14, 2022 12:49 PM (UTC)",,
Tips To Get Start Upload Ideas And Publishing Resources - PDF Free Download - QDOC.TIPS,Upload Ideas And Publishing Resources Write A Book PDF Free Download Professional Platform,https://qdoc.tips,BOOKMRKS-MTHRFCKR / REFERENCE-MTHRFCKR / DocArticles,doc articles,"September 14, 2022 12:49 PM (UTC)",https://edoc.pub/assets/img/edocsite_logo.png,
PubMed,"PubMed® comprises more than 34 million citations for biomedical literature from MEDLINE, life science journals, and online books. Citations may include links to full text content from PubMed Central and publisher web sites.",https://pubmed.ncbi.nlm.nih.gov,BOOKMRKS-MTHRFCKR / REFERENCE-MTHRFCKR / DocArticles,doc articles,"September 14, 2022 12:49 PM (UTC)",https://cdn.ncbi.nlm.nih.gov/pubmed/persistent/pubmed-meta-image.png,
"750,000+ texts, PDFs, eBooks and images | Higher Intellect","Higher Intellect is a World Wide Web server hosting a searchable database of over 750,000 text files on a variety of subjects. We also host a server running on the Hotline and KDX protocols featuring a vast collection of antique software, obscure operating systems and open source software.",https://preterhuman.net,BOOKMRKS-MTHRFCKR / REFERENCE-MTHRFCKR / DocArticles,doc articles,"September 14, 2022 12:49 PM (UTC)",,
Share and Discover Knowledge,"Find your presentations, infographics, documents. Share what you know and love through presentations, infographics, documents and more",https://pdfslide.net,BOOKMRKS-MTHRFCKR / REFERENCE-MTHRFCKR / DocArticles,doc articles,"September 14, 2022 12:49 PM (UTC)",https://pdfslide.net/public/t1/images/1200x630.jpg,
Access millions of research paper PDFs in one click,PaperPanda searches the web for PDFs so you don’t have to. Get the free Chrome extension now,https://paperpanda.app,BOOKMRKS-MTHRFCKR / REFERENCE-MTHRFCKR / DocArticles,doc articles,"September 14, 2022 12:49 PM (UTC)",https://paperpanda.app/images/og.png,
https://paperity.org/,,https://paperity.org,BOOKMRKS-MTHRFCKR / REFERENCE-MTHRFCKR / DocArticles,doc articles,"September 14, 2022 12:49 PM (UTC)",,
Home | Open Payments Data - CMS,,https://openpaymentsdata.cms.gov,BOOKMRKS-MTHRFCKR / REFERENCE-MTHRFCKR / DocArticles,doc articles,"September 14, 2022 12:49 PM (UTC)",,
OpenMD.com Health Search Engine,"Health search engine indexing billions of documents from government agencies, leading health publishers, health organizations, medical journals, and reference sites.",https://openmd.com,BOOKMRKS-MTHRFCKR / REFERENCE-MTHRFCKR / DocArticles,doc articles,"September 14, 2022 12:49 PM (UTC)",https://openmd.com/images/illustrations/bg-main.png,
OATD – Open Access Theses and Dissertations,,https://oatd.org,BOOKMRKS-MTHRFCKR / REFERENCE-MTHRFCKR / DocArticles,doc articles,"September 14, 2022 12:49 PM (UTC)",,
Search,,https://ntrs.nasa.gov/search.jsp,BOOKMRKS-MTHRFCKR / REFERENCE-MTHRFCKR / DocArticles,doc articles,"September 14, 2022 12:49 PM (UTC)",,
Home | National Security Archive,,https://nsarchive.gwu.edu,BOOKMRKS-MTHRFCKR / REFERENCE-MTHRFCKR / DocArticles,doc articles,"September 14, 2022 12:49 PM (UTC)",,
Web of Science Master Journal List,"Try our new Master Journal List site, by the Web of Science Group, a Clarivate company.",https://mjl.clarivate.com,BOOKMRKS-MTHRFCKR / REFERENCE-MTHRFCKR / DocArticles,doc articles,"September 14, 2022 12:49 PM (UTC)",https://mjl.clarivate.com/assets/WS410212424_250x250.jpg,
How to Use Sci-Hub to download PDF (Full Text) with Zotero,Add a custom PDF resolver in Zotero,https://medium.com/@gagarine/use-sci-hub-with-zotero-as-a-fall-back-pdf-resolver-cf139eb2cea7,BOOKMRKS-MTHRFCKR / REFERENCE-MTHRFCKR / DocArticles,doc articles,"September 14, 2022 12:49 PM (UTC)",https://miro.medium.com/max/712/1*9RC6_8PSSWG8P8-6nMTvLQ.png,
https://link.springer.com/,,https://link.springer.com,BOOKMRKS-MTHRFCKR / REFERENCE-MTHRFCKR / DocArticles,doc articles,"September 14, 2022 12:49 PM (UTC)",,
Liebertpub,,https://liebertpub.com,BOOKMRKS-MTHRFCKR / REFERENCE-MTHRFCKR / DocArticles,doc articles,"September 14, 2022 12:49 PM (UTC)",https://www.liebertpub.com/action/showCoverImage?journalCode=,
Documents and E-books,Your ultimate source of e-book and documents,https://idoc.pub,BOOKMRKS-MTHRFCKR / REFERENCE-MTHRFCKR / DocArticles,doc articles,"September 14, 2022 12:49 PM (UTC)",https://idoc.pub/static/img/og-image.png,
Heystack 🟧,Discover the best public Google docs,https://heystacks.org,BOOKMRKS-MTHRFCKR / REFERENCE-MTHRFCKR / DocArticles,doc articles,"September 14, 2022 12:49 PM (UTC)",https://heystacks.com/banner.jpg,
DOI to Sci-Hub,Highlight DOI link on the current webpage and redirect it to Sci-Hub.,https://greasyfork.org/en/scripts/412498,BOOKMRKS-MTHRFCKR / REFERENCE-MTHRFCKR / DocArticles,doc articles,"September 14, 2022 12:49 PM (UTC)",,
GitHub - papers-we-love/papers-we-love: Papers from the computer science community to read and discuss.,Papers from the computer science community to read and discuss. - GitHub - papers-we-love/papers-we-love: Papers from the computer science community to read and discuss.,https://github.com/papers-we-love/papers-we-love,BOOKMRKS-MTHRFCKR / REFERENCE-MTHRFCKR / DocArticles,doc articles,"September 14, 2022 12:49 PM (UTC)",https://opengraph.githubassets.com/50e427ac6771fccad6bbce50d5d05cf913f26d5d847dfeaf100d7d95e658b53b/papers-we-love/papers-we-love,
GitHub - IDEACVR/awesome-detection-transformer: Collect some papers about transformer for detection and segmentation. Awesome Detection Transformer for Computer Vision (CV),Collect some papers about transformer for detection and segmentation. Awesome Detection Transformer for Computer Vision (CV) - GitHub - IDEACVR/awesome-detection-transformer: Collect some papers ab...,https://github.com/ideacvr/awesome-detection-transformer,BOOKMRKS-MTHRFCKR / REFERENCE-MTHRFCKR / DocArticles,doc articles,"September 14, 2022 12:49 PM (UTC)",https://opengraph.githubassets.com/75d521be251bfbac6460851e84acf133792a4f8345709caa1774dc6ccfee9429/IDEA-Research/awesome-detection-transformer,
"GitHub - gchenfc/sci-hub-now: Free access to academic papers with just a single click! Abolish publishers, long live the open access movement! 🦅","Free access to academic papers with just a single click! Abolish publishers, long live the open access movement! 🦅 - GitHub - gchenfc/sci-hub-now: Free access to academic papers with just a single ...",https://github.com/gchenfc/sci-hub-now,BOOKMRKS-MTHRFCKR / REFERENCE-MTHRFCKR / DocArticles,doc articles,"September 14, 2022 12:49 PM (UTC)",https://opengraph.githubassets.com/c92c8318345c30654b620bafc3b57a8d6f2e01c4fa74157433afff22abcbbfba/gchenfc/sci-hub-now,
GitHub - alephdata/aleph: Search and browse documents and data; find the people and companies you look for.,Search and browse documents and data; find the people and companies you look for. - GitHub - alephdata/aleph: Search and browse documents and data; find the people and companies you look for.,https://github.com/alephdata/aleph,BOOKMRKS-MTHRFCKR / REFERENCE-MTHRFCKR / DocArticles,doc articles,"September 14, 2022 12:49 PM (UTC)",https://opengraph.githubassets.com/b43b8ca86dfb766423743fd8d76b5ab2450dff84592b1aca9aaa00c9c37d4cc3/alephdata/aleph,
FreeFullPDF,"Download over 80 million free science papers, patents, theses and posters",https://freefullpdf.com,BOOKMRKS-MTHRFCKR / REFERENCE-MTHRFCKR / DocArticles,doc articles,"September 14, 2022 12:49 PM (UTC)",,
OpenAIRE | Find and Share research,"OpenAIRE Explore: Over 100M of research deduplicated, 170K research software, 11M research data. One of the largest open scholarly records collection worldwide.",https://explore.openaire.eu,BOOKMRKS-MTHRFCKR / REFERENCE-MTHRFCKR / DocArticles,doc articles,"September 14, 2022 12:49 PM (UTC)",https://explore.openaire.eu/assets/common-assets/common/Symbol.png,
UBIRA ETheses - University of Birmingham eData Repository,,https://etheses.bham.ac.uk,BOOKMRKS-MTHRFCKR / REFERENCE-MTHRFCKR / DocArticles,doc articles,"September 14, 2022 12:49 PM (UTC)",,
ERIC - Education Resources Information Center,"ERIC is an online library of education research and information, sponsored by the Institute of Education Sciences (IES) of the U.S. Department of Education.",https://eric.ed.gov,BOOKMRKS-MTHRFCKR / REFERENCE-MTHRFCKR / DocArticles,doc articles,"September 14, 2022 12:49 PM (UTC)",https://eric.ed.gov/img/icon_fbshare.png,
"Wikisource, the free library",,https://en.wikisource.org,BOOKMRKS-MTHRFCKR / REFERENCE-MTHRFCKR / DocArticles,doc articles,"September 14, 2022 12:49 PM (UTC)",,
Digital Einstein Papers Home,,https://einsteinpapers.press.princeton.edu,BOOKMRKS-MTHRFCKR / REFERENCE-MTHRFCKR / DocArticles,doc articles,"September 14, 2022 12:49 PM (UTC)",,
Documents Free Download PDF,Free Document Download PDF,https://edoc.tips,BOOKMRKS-MTHRFCKR / REFERENCE-MTHRFCKR / DocArticles,doc articles,"September 14, 2022 12:49 PM (UTC)",https://edoc.tips/theme/img/logo-edoc-square.png,
Essays and primary source documents,Explore and download millions of e-book and documents for free,https://doku.pub,BOOKMRKS-MTHRFCKR / REFERENCE-MTHRFCKR / DocArticles,doc articles,"September 14, 2022 12:49 PM (UTC)",https://doku.pub/static/img/og-image.png,
"Enjoy free comfortable tools to publish, exchange, and share any kind of documents online!",,https://docplayer.net,BOOKMRKS-MTHRFCKR / REFERENCE-MTHRFCKR / DocArticles,doc articles,"September 14, 2022 12:49 PM (UTC)",,
Distributed Denial of Secrets,,https://ddosecrets.com,BOOKMRKS-MTHRFCKR / REFERENCE-MTHRFCKR / DocArticles,doc articles,"September 14, 2022 12:49 PM (UTC)",,
Dataset Search,,https://datasetsearch.research.google.com,BOOKMRKS-MTHRFCKR / REFERENCE-MTHRFCKR / DocArticles,doc articles,"September 14, 2022 12:49 PM (UTC)",,
Home Page,"The Data Catalog is designed to make World Bank's development data easy to find, download, use, and share. It includes data from the World Bank's microdata, finances and energy data platforms, as well as datasets from the open data catalog",https://datacatalog.worldbank.org,BOOKMRKS-MTHRFCKR / REFERENCE-MTHRFCKR / DocArticles,doc articles,"September 14, 2022 12:49 PM (UTC)",https://datacatalog.worldbank.org/assets/image/homepage.png,
Mendeley Data,"Upload your research data, share with select users and make it publicly available and citable",https://data.mendeley.com,BOOKMRKS-MTHRFCKR / REFERENCE-MTHRFCKR / DocArticles,doc articles,"September 14, 2022 12:49 PM (UTC)",,
https://cse.google.com/cse?cx=000013508089310229747:qf70z1tyrs0,,https://cse.google.com/cse?cx=000013508089310229747%3Aqf70z1tyrs0,BOOKMRKS-MTHRFCKR / REFERENCE-MTHRFCKR / DocArticles,doc articles,"September 14, 2022 12:49 PM (UTC)",,
CORE – Aggregating the world’s open access research papers,The world’s largest collection of open access research papers,https://core.ac.uk,BOOKMRKS-MTHRFCKR / REFERENCE-MTHRFCKR / DocArticles,doc articles,"September 14, 2022 12:49 PM (UTC)",,
Home,,https://contempaesthetics.org,BOOKMRKS-MTHRFCKR / REFERENCE-MTHRFCKR / DocArticles,doc articles,"September 14, 2022 12:49 PM (UTC)",,
Research PDF Free Download Flatform - COEK.INFO,PDF Free Download Flatform - Start Research Documents,https://coek.info,BOOKMRKS-MTHRFCKR / REFERENCE-MTHRFCKR / DocArticles,doc articles,"September 14, 2022 12:49 PM (UTC)",https://coek.info/images/global/kundoc_logo.png,
welcome | CIRES,,https://cires.colorado.edu,BOOKMRKS-MTHRFCKR / REFERENCE-MTHRFCKR / DocArticles,doc articles,"September 14, 2022 12:49 PM (UTC)",,
Censored Planet,"An Internet-wide, Longitudinal Censorship Observatory.",https://censoredplanet.org,BOOKMRKS-MTHRFCKR / REFERENCE-MTHRFCKR / DocArticles,doc articles,"September 14, 2022 12:49 PM (UTC)",https://censoredplanet.org/assets/vertical_generic.png,
The Internet censorship bibliography,,https://censorbib.nymity.ch,BOOKMRKS-MTHRFCKR / REFERENCE-MTHRFCKR / DocArticles,doc articles,"September 14, 2022 12:49 PM (UTC)",,
Army Publishing Directorate,Army DA administrative publications and forms by the Army Publishing Directorate APD. The latest technologies high quality electronic pubs and forms view U.S. Army Regulations and DA Forms.,https://armypubs.army.mil,BOOKMRKS-MTHRFCKR / REFERENCE-MTHRFCKR / DocArticles,doc articles,"September 14, 2022 12:49 PM (UTC)",,
https://archives.parliament.uk/,,https://archives.parliament.uk,BOOKMRKS-MTHRFCKR / REFERENCE-MTHRFCKR / DocArticles,doc articles,"September 14, 2022 12:49 PM (UTC)",,
"US Military Manual Collection : Free Texts : Free Download, Borrow and Streaming : Internet Archive","United States Army Field Manuals are published by the United States Army's Army Publishing Directorate. As of 27 July 2007, some 542 field manuals were in use. They contain detailed information and how-tos for procedures important to soldiers serving in the field. They are usually available to the...",https://archive.org/details/military-manuals,BOOKMRKS-MTHRFCKR / REFERENCE-MTHRFCKR / DocArticles,doc articles,"September 14, 2022 12:49 PM (UTC)",,
Litmaps is an online research platform,"Visualise, expand, and share your research expertise using an intuitive citation graph interface.",https://app.litmaps.co,BOOKMRKS-MTHRFCKR / REFERENCE-MTHRFCKR / DocArticles,doc articles,"September 14, 2022 12:49 PM (UTC)",,
Sci-Hub Scholar – Get this Extension for 🦊 Firefox (en-US),Download Sci-Hub Scholar for Firefox. Modifies search result links from Google Scholar to Sci-Hub pages.,https://addons.mozilla.org/en-us/firefox/addon/sci-hub-scholar,BOOKMRKS-MTHRFCKR / REFERENCE-MTHRFCKR / DocArticles,doc articles,"September 14, 2022 12:49 PM (UTC)",https://addons.mozilla.org/user-media/previews/full/267/267289.png?modified=1647109903,
Scholarpedia,,http://www.scholarpedia.org,BOOKMRKS-MTHRFCKR / REFERENCE-MTHRFCKR / DocArticles,doc articles,"September 14, 2022 12:49 PM (UTC)",,
Alex Catalogue of Electronic Texts,,http://www.infomotions.com/alex,BOOKMRKS-MTHRFCKR / REFERENCE-MTHRFCKR / DocArticles,doc articles,"September 14, 2022 12:49 PM (UTC)",,
Free Medical Journals|by Amedeo.com,Over 4000 free medical journals. Daily presentations of new journals. Free subscription to the journal alerts.,http://www.freemedicaljournals.com,BOOKMRKS-MTHRFCKR / REFERENCE-MTHRFCKR / DocArticles,doc articles,"September 14, 2022 12:49 PM (UTC)",,
"PDF SEARCH ENGINE - PDF,DOC,PPT,Ebook search ENGINE",,http://www.findpdfdoc.com,BOOKMRKS-MTHRFCKR / REFERENCE-MTHRFCKR / DocArticles,doc articles,"September 14, 2022 12:49 PM (UTC)",,
Eurasian Scientific Journal Index,,http://www.esjindex.org,BOOKMRKS-MTHRFCKR / REFERENCE-MTHRFCKR / DocArticles,doc articles,"September 14, 2022 12:49 PM (UTC)",,
http://www.bioline.org.br/,,http://www.bioline.org.br,BOOKMRKS-MTHRFCKR / REFERENCE-MTHRFCKR / DocArticles,doc articles,"September 14, 2022 12:49 PM (UTC)",,
List of sci hub and libgen active urls - Verts-Luisants,"All science journal papers or books for free through libgen and sci hub servers, proxys, to download",http://vertsluisants.fr/index.php?article4%2Fwhere-scihub-libgen-server-down=,BOOKMRKS-MTHRFCKR / REFERENCE-MTHRFCKR / DocArticles,doc articles,"September 14, 2022 12:49 PM (UTC)",,
Global ETD Search,,http://search.ndltd.org,BOOKMRKS-MTHRFCKR / REFERENCE-MTHRFCKR / DocArticles,doc articles,"September 14, 2022 12:49 PM (UTC)",,
PANDORA Web Archive,,http://pandora.nla.gov.au,BOOKMRKS-MTHRFCKR / REFERENCE-MTHRFCKR / DocArticles,doc articles,"September 14, 2022 12:49 PM (UTC)",,
SciSpace by Typeset,Get unrestricted access to 270+ Million research articles and connect with millions of researchers. Join SciSpace (by Typeset) for wider discovery and great visibility.,https://typeset.io,BOOKMRKS-MTHRFCKR / REFERENCE-MTHRFCKR / DocArticles,"doc articles, scientiffic research","September 14, 2022 5:25 PM (UTC)",https://typeset-cdn-server-endgame.s3.amazonaws.com/images/scispace/scispace-cover.png,
"Treatment for amphetamine withdrawal - Shoptaw, SJ - 2009 | Cochrane Library",,https://www.cochranelibrary.com/cdsr/doi/10.1002/14651858.CD003021.pub2/full,BOOKMRKS-MTHRFCKR / REFERENCE-MTHRFCKR / DocArticles,doc articles,"October 1, 2022 7:52 PM (UTC)",,
Passport Index,"Passport Index curates, sorts and ranks the world's passports. Explore passport designs, browse by visa-free score, color, or country and discover how they rank.",https://www.passportindex.org,BOOKMRKS-MTHRFCKR / REFERENCE-MTHRFCKR / DocArticles / Document Checking,doc checking,"October 3, 2022 5:06 AM (UTC)",https://www.passportindex.org/images/social/Passport-Index-Explore.jpg,
Nidsenter.no,,https://www.nidsenter.no,BOOKMRKS-MTHRFCKR / REFERENCE-MTHRFCKR / DocArticles / Document Checking,doc checking,"October 3, 2022 5:06 AM (UTC)",https://www.nidsenter.no/content/img/og-nid-logo.png,
Search | International Court of Justice,Search,https://www.icj-cij.org/en/advanced-search,BOOKMRKS-MTHRFCKR / REFERENCE-MTHRFCKR / DocArticles / Document Checking,doc checking,"October 3, 2022 5:06 AM (UTC)",,
Ifado.consilium.europa.eu,,https://www.ifado.consilium.europa.eu,BOOKMRKS-MTHRFCKR / REFERENCE-MTHRFCKR / DocArticles / Document Checking,doc checking,"October 3, 2022 5:06 AM (UTC)",,
Documentchecker.com,The solution for checking the world's identity documents and banknotes,https://www.documentchecker.com,BOOKMRKS-MTHRFCKR / REFERENCE-MTHRFCKR / DocArticles / Document Checking,doc checking,"October 3, 2022 5:06 AM (UTC)",,
"Database of Free Online Computer Science and Programming Books, Textbooks, and Lecture Notes","This site lists free online computer science, engineering and programming books, textbooks and lecture notes, all of which are legally and freely available.",https://www.freetechbooks.com/,BOOKMRKS-MTHRFCKR / REFERENCE-MTHRFCKR / Ebooks,ebooks,"February 5, 2023 4:59 AM (UTC)",https://www.freetechbooks.com/uploads/logo_left.gif,
"Free-eBooks.net | Download free Fiction, Health, Romance and many more books","Free-eBooks.net is the internet's #1 source for free eBook downloads, eBook resources & eBook authors. Read & download eBooks for Free: anytime!",https://www.free-ebooks.net/,BOOKMRKS-MTHRFCKR / REFERENCE-MTHRFCKR / Ebooks,ebooks,"February 5, 2023 4:59 AM (UTC)",,
Free Computer Art Business & Investing ebooks,Free Computer Art Business & Investing ebooks. Thousands of free ebooks to choose from all are free.,https://www.ebooklobby.com/,BOOKMRKS-MTHRFCKR / REFERENCE-MTHRFCKR / Ebooks,ebooks,"February 5, 2023 4:59 AM (UTC)",,
Free eBooks Download - ebook3000.com,,http://www.ebook3000.com/,BOOKMRKS-MTHRFCKR / REFERENCE-MTHRFCKR / Ebooks,ebooks,"February 5, 2023 4:59 AM (UTC)",,
Directory of Open Access Journals – DOAJ,"DOAJ is a unique and extensive index of diverse open access journals from around the world, driven by a growing community, committed to ensuring quality content is freely available online for everyone.",https://www.doaj.org/,BOOKMRKS-MTHRFCKR / REFERENCE-MTHRFCKR / Ebooks,ebooks,"February 5, 2023 4:59 AM (UTC)",https://doaj.org/assets/img/opengraph/img.png,
Bibliomania - Free Online Literature and Study Guides,"800+ texts of classic literature, drama, and poetry  	together with detailed literature study guides. Large reference book and non-fiction section",http://www.bibliomania.com/,BOOKMRKS-MTHRFCKR / REFERENCE-MTHRFCKR / Ebooks,ebooks,"February 5, 2023 4:59 AM (UTC)",,
Authorama - Public Domain Books,Public domain books to read online.,http://www.authorama.com/,BOOKMRKS-MTHRFCKR / REFERENCE-MTHRFCKR / Ebooks,ebooks,"February 5, 2023 4:59 AM (UTC)",,
Imperial Library of Trantor,,https://trantor.is/,BOOKMRKS-MTHRFCKR / REFERENCE-MTHRFCKR / Ebooks,ebooks,"February 5, 2023 4:59 AM (UTC)",,
eBookBB - Find Yourself Something New to Read,eBookBB is a free service for readers to find books across many genres. You can discover a new author and find a good book to fill up your reading device in just a few clicks.,https://ebookbb.in/,BOOKMRKS-MTHRFCKR / REFERENCE-MTHRFCKR / Ebooks,ebooks,"February 5, 2023 4:58 AM (UTC)",,
Programmable Search Engine,,https://cse.google.com/cse?cx=c46414ccb6a943e39,BOOKMRKS-MTHRFCKR / REFERENCE-MTHRFCKR / Ebooks,ebooks,"February 5, 2023 4:58 AM (UTC)",,
EPUB to PDF | CloudConvert,>EPUB to PDF Converter - CloudConvert is a free & fast online file conversion service.,https://cloudconvert.com/epub-to-pdf,BOOKMRKS-MTHRFCKR / REFERENCE-MTHRFCKR / Ebooks,ebooks,"February 5, 2023 4:58 AM (UTC)",,
By The Fireplace,,https://bythefireplace.com/,BOOKMRKS-MTHRFCKR / REFERENCE-MTHRFCKR / Ebooks,ebooks,"February 5, 2023 4:58 AM (UTC)",https://bythefireplace.com/assets/img/BTF-OG-image.png,
(3) The Ultimate Guide To Finding Ebooks (+ site dump) : EBook_Resources,227 votes and 35 comments so far on Reddit,https://www.reddit.com/r/EBook_Resources/comments/k3cy49/the_ultimate_guide_to_finding_ebooks_site_dump/,BOOKMRKS-MTHRFCKR / REFERENCE-MTHRFCKR / Ebooks,ebooks,"February 5, 2023 4:58 AM (UTC)",https://external-preview.redd.it/mDcytZOdfsgIWlQw6Jg1tx1KjMlZEvC-ifmzeuL8qbc.jpg?auto=webp&v=enabled&s=88233f8bdc0478bc33234abb30727914b33e5a63,
100% Free eBooks for All Devices,,https://www.planetebook.com/,BOOKMRKS-MTHRFCKR / REFERENCE-MTHRFCKR / Ebooks,ebooks,"February 5, 2023 4:58 AM (UTC)",,
Learn IT,,https://www.pdfchm.net/,BOOKMRKS-MTHRFCKR / REFERENCE-MTHRFCKR / Ebooks,ebooks,"February 5, 2023 4:58 AM (UTC)",,
