title,description,url,folder,tags,created,cover,highlights
Library Genesis,,https://libgen.lc/,BOOKMRKS-MTHRFCKR / REFERENCE-MTHRFCKR / Academic,libgen,"January 2, 2023 7:41 AM (UTC)",,
SCRIBD.VPDFS.COM,Scribd.VPDFS.com is a scribd downloader online service allow user to get the documents from scribd instantly.,https://scribd.vpdfs.com/,BOOKMRKS-MTHRFCKR / REFERENCE-MTHRFCKR / Academic,academic,"December 22, 2022 3:17 PM (UTC)",https://up.raindrop.io/raindrop/thumbs/489/767/780/img.jpeg,
"Top 70,000 Educational YouTube Channels Organized By Category",,https://limnology.co/,BOOKMRKS-MTHRFCKR / REFERENCE-MTHRFCKR / Academic,academic,"December 22, 2022 3:10 PM (UTC)",,
The Feynman Lectures on Physics,,https://www.feynmanlectures.caltech.edu/,BOOKMRKS-MTHRFCKR / REFERENCE-MTHRFCKR / Academic,academic,"December 22, 2022 3:08 PM (UTC)",https://up.raindrop.io/raindrop/thumbs/489/766/955/img.jpeg,
eduMedia,Interactive Resources for Learning Science.,https://www.edumedia-sciences.com/en/,BOOKMRKS-MTHRFCKR / REFERENCE-MTHRFCKR / Academic,science teaching materials,"December 22, 2022 1:31 PM (UTC)",https://www.edumedia-sciences.com/bundles/edumediafront/image/logotype-www.png,
Scilit.net,"Scilit is a centralized platform for all published research literature, articles with a DOI or in PubMed are indexed within hours",https://www.scilit.net,BOOKMRKS-MTHRFCKR / REFERENCE-MTHRFCKR / Academic,academic,"February 24, 2022 1:17 PM (UTC)",,
Researchgate,,https://www.researchgate.net/search/publication?q=,BOOKMRKS-MTHRFCKR / REFERENCE-MTHRFCKR / Academic,academic,"February 24, 2022 1:17 PM (UTC)",,
MyScienceWork,"We transform Science into Innovation, R&D Studies, Research Trends, Real Time Dashboards, IP Strategy Decisions",https://www.mysciencework.com,BOOKMRKS-MTHRFCKR / REFERENCE-MTHRFCKR / Academic,academic,"February 24, 2022 1:17 PM (UTC)",,
Microsoft Academic,"Explore Microsoft products and services for your home or business. Shop Surface, Microsoft 365, Xbox, Windows, Azure, and more. Find downloads and get support.",https://academic.microsoft.com/home,BOOKMRKS-MTHRFCKR / REFERENCE-MTHRFCKR / Academic,academic,"February 24, 2022 1:17 PM (UTC)",,
Google Scholar,,https://scholar.google.com/schhp?as_sdt=0%2C5&hl=en,BOOKMRKS-MTHRFCKR / REFERENCE-MTHRFCKR / Academic,academic,"February 24, 2022 1:17 PM (UTC)",,
Dimensions,"Re-imagining discovery and access to research: grants, datasets, publications, citations, clinical trials, patents and policy documents in one place. With more than 100 million publications...",https://app.dimensions.ai/discover/publication,BOOKMRKS-MTHRFCKR / REFERENCE-MTHRFCKR / Academic,academic,"February 24, 2022 1:17 PM (UTC)",,
BASE,More than 200 mio. scientfic documents from more than 8000 content providers. BASE is one of the world's most voluminous search engines for academic web resources.,https://www.base-search.net,BOOKMRKS-MTHRFCKR / REFERENCE-MTHRFCKR / Academic,academic,"February 24, 2022 1:17 PM (UTC)",,
RefSeek - Academic Search Engine,"Academic search engine for students and researchers. Locates relevant academic search results from web pages, books, encyclopedias, and journals.",https://www.refseek.com,BOOKMRKS-MTHRFCKR / REFERENCE-MTHRFCKR / Academic,"academic, encyclopedia, engine, search","June 6, 2022 7:01 AM (UTC)",,
Msearch.io,"Find treatment guidelines, comprehensive reviews, and medical journal articles from credible sources. msearch.io employs advanced analytics to display relevant results for the clinical setting.",https://msearch.io,BOOKMRKS-MTHRFCKR / REFERENCE-MTHRFCKR / Academic,academic,"June 6, 2022 7:01 AM (UTC)",,
Google Colaboratory,,https://colab.research.google.com/github/shirooo39/MiXLab/blob/master/MiXLab.ipynb,BOOKMRKS-MTHRFCKR / REFERENCE-MTHRFCKR / Academic,academic,"October 2, 2022 4:47 AM (UTC)",https://colab.research.google.com/img/colab_favicon_256px.png,
Crafton Hills College | CCC MyPath,CCCMyPath: Follow your dreams,https://www.cccmypath.org/uPortal/f/u7859l1s1000/normal/render.uP#session_state=fe5d7586-21c2-44e9-9e1b-19509decc737&code=24e56c0f-b3f4-4ef0-9b09-510b3f5e911d.fe5d7586-21c2-44e9-9e1b-19509decc737.1a9e2586-6f11-4403-8d0b-8f07b75d1ab8,BOOKMRKS-MTHRFCKR / REFERENCE-MTHRFCKR / Academic,academic,"October 3, 2022 1:01 AM (UTC)",,
Temporary Email - Ma Jianjun University Free Education Email,"What is a temporary education mailbox?
Temporary education mailbox: It is an educational mailbox that can be randomly generated, also known as white prostitution mailbox, privacy mailbox, 10-minute temporary mail, daily disposable mailbox, and it is 100% anonymous and anti-tracking.

The difference between this mailbox and other temporary mailboxes is that the educational mailbox of this site can pass the education certification of some websites and enjoy educational discounts, such as scanning the Almighty King App and registering with this site mailbox to be a student member for free. The scanned copy can remove the advertising watermark, and the number of image recognition times will be given. The mailbox of this site is permanently free. Welcome to prostitution. If you buy it for a fee, then you may be prostituted by others. For more resources for free prostitution, please visit the wool community below.",https://mail.mjj.edu.ge,BOOKMRKS-MTHRFCKR / REFERENCE-MTHRFCKR / Academic,academic,"October 3, 2022 1:02 AM (UTC)",,
The most populer free Temp mail - Fast ✔️ - 10minutesemail,"You can generate Temp mail addresses with the worlds most popular 10 minute mail site, try our fast and free disposable e-mail services.",https://10minutesemail.net,BOOKMRKS-MTHRFCKR / REFERENCE-MTHRFCKR / Academic,academic,"October 3, 2022 1:02 AM (UTC)",,
Zetoc: Homepage,"Following a review of Zetoc and in consultation with the British Library, we have retired the service as of 1 August 2022.",http://zetoc.jisc.ac.uk,BOOKMRKS-MTHRFCKR / REFERENCE-MTHRFCKR / Academic,academic,"October 3, 2022 3:57 PM (UTC)",,
Free Online Legal Research | Lexis® Web,LexisNexis users sign in here. Click here to login and begin conducting your legal research now.,http://lexisweb.com,BOOKMRKS-MTHRFCKR / REFERENCE-MTHRFCKR / Academic,academic,"October 3, 2022 3:57 PM (UTC)",,
AcademicIndex,"Academic search engine for students and researchers. Locates relevant academic search results from web pages, books, encyclopedias, and journals.",http://www.academicindex.net,BOOKMRKS-MTHRFCKR / REFERENCE-MTHRFCKR / Academic,academic,"October 3, 2022 3:57 PM (UTC)",,
Microsoft Academic Search,,http://academic.research.microsoft.com,BOOKMRKS-MTHRFCKR / REFERENCE-MTHRFCKR / Academic,academic,"October 3, 2022 3:57 PM (UTC)",,
Google Scholar,"Google Scholar provides a simple way to broadly search for scholarly literature. Search across a wide variety of disciplines and sources: articles, theses, books, abstracts and court opinions.",http://scholar.google.de,BOOKMRKS-MTHRFCKR / REFERENCE-MTHRFCKR / Academic,academic,"October 3, 2022 3:57 PM (UTC)",,
ArnetMiner - Academic Researcher Social Network Search,AMiner由清华大学计算机科学与技术系建立，包含了超过3.2亿学术论文/专利和1.33 亿学者的科技图谱，提供推荐订阅、论文检索、智慧人才、趋势分析等科技情报专业化服务，是拥有我国完全自主知识产权的学术科技情报大数据挖掘与服务系统平台。,http://arnetminer.org,BOOKMRKS-MTHRFCKR / REFERENCE-MTHRFCKR / Academic,academic,"October 3, 2022 3:57 PM (UTC)",,
Sci-hub.ru,,https://sci-hub.ru,BOOKMRKS-MTHRFCKR / REFERENCE-MTHRFCKR / Academic,academic,"October 3, 2022 3:45 PM (UTC)",,
lumendatabase.org,,https://lumendatabase.org,BOOKMRKS-MTHRFCKR / REFERENCE-MTHRFCKR / Academic,academic,"October 3, 2022 3:45 PM (UTC)",,
https://education.iseek.com/iseek/home.page,,https://education.iseek.com/iseek/home.page,BOOKMRKS-MTHRFCKR / REFERENCE-MTHRFCKR / Academic,academic,"October 3, 2022 3:45 PM (UTC)",,
Copyscape Plagiarism Checker - Duplicate Content Detection Software,Copyscape is a free plagiarism checker. The software lets you detect duplicate content and check if your text is original.,https://www.copyscape.com,BOOKMRKS-MTHRFCKR / REFERENCE-MTHRFCKR / Academic,academic,"October 3, 2022 3:45 PM (UTC)",,
isanchop/stuhack: Chrome extension for studocu premium free,Chrome extension for studocu premium free. Contribute to isanchop/stuhack development by creating an account on GitHub.,https://github.com/isanchop/stuhack,BOOKMRKS-MTHRFCKR / REFERENCE-MTHRFCKR / Academic,academic,"October 7, 2022 3:03 AM (UTC)",https://opengraph.githubassets.com/bee581b39dff623a3c26d36d81c9cecd69705cda3ef62c23eb68ab3f302fbfde/isanchop/stuhack,
"StuDocu - Free summaries, lecture notes & exam prep","Share free summaries, lecture notes, exam prep and more!!",https://www.studocu.com/en-us,BOOKMRKS-MTHRFCKR / REFERENCE-MTHRFCKR / Academic,academic,"October 7, 2022 3:03 AM (UTC)",,
LibGuides Community,,https://community.libguides.com,BOOKMRKS-MTHRFCKR / REFERENCE-MTHRFCKR / Academic / Academic and Grey Literature Research Tools,academic,"October 3, 2022 5:06 AM (UTC)",,
Biosearch.berkeley.edu,,https://biosearch.berkeley.edu,BOOKMRKS-MTHRFCKR / REFERENCE-MTHRFCKR / Academic / Academic and Grey Literature Research Tools,academic,"October 3, 2022 5:06 AM (UTC)",,
Loadb.org,"Listing of Open Access Database (LOADB) is to create a web-enabled, linked, classified and categorized collection of Open Access (freely available) Science and Technology Databases.  Developed and maintained by CSIR-UDRIP, Pune",https://www.loadb.org,BOOKMRKS-MTHRFCKR / REFERENCE-MTHRFCKR / Academic / Academic and Grey Literature Research Tools,academic,"October 3, 2022 5:06 AM (UTC)",https://www.loadb.org/img/loadb_fb_banner.jpg,
Ispybio.com,"iSpyBio, An intelligent search engine that compares products from suppliers such as antibodies, ELISA kits, proteins, biomolecules, inhibitors, cDNA, lysates and others",https://www.ispybio.com,BOOKMRKS-MTHRFCKR / REFERENCE-MTHRFCKR / Academic / Academic and Grey Literature Research Tools,academic,"October 3, 2022 5:06 AM (UTC)",,
Greynet.org,"The Grey Literature Network Service, widely known as GreyNet, facilitates dialog, research, and communication between persons and organisations in the field of grey literature. GreyNet further seeks to identify and distribute information on and about grey literature in networked environments. Its main activities include the International Conference Series on Grey Literature, the creation and maintenance of web-based resources, the establishment of a moderated Listserv, GL Compendium, The Grey Journal, and Course curricula for LIS Colleges and Schools.",https://www.greynet.org,BOOKMRKS-MTHRFCKR / REFERENCE-MTHRFCKR / Academic / Academic and Grey Literature Research Tools,academic,"October 3, 2022 5:06 AM (UTC)",,
Greylit.org,,https://www.greylit.org,BOOKMRKS-MTHRFCKR / REFERENCE-MTHRFCKR / Academic / Academic and Grey Literature Research Tools,academic,"October 3, 2022 5:06 AM (UTC)",,
Library (Getty Research Institute),The Research Library at the Getty Research Institute.,https://www.getty.edu/research/library,BOOKMRKS-MTHRFCKR / REFERENCE-MTHRFCKR / Academic / Academic and Grey Literature Research Tools,academic,"October 3, 2022 5:06 AM (UTC)",,
African Journals Online (AJOL),,https://www.ajol.info,BOOKMRKS-MTHRFCKR / REFERENCE-MTHRFCKR / Academic / Academic and Grey Literature Research Tools,academic,"October 3, 2022 5:06 AM (UTC)",,
Academic Journals,Academic Journals accelerates the dissemination of knowledge through the publication of high quality research articles using the open access model.,https://www.academicjournals.org,BOOKMRKS-MTHRFCKR / REFERENCE-MTHRFCKR / Academic / Academic and Grey Literature Research Tools,academic,"October 3, 2022 5:06 AM (UTC)",https://www.academicjournals.org/img/aj.png,
Research.omicsgroup.org,,https://research.omicsgroup.org,BOOKMRKS-MTHRFCKR / REFERENCE-MTHRFCKR / Academic / Academic and Grey Literature Research Tools,academic,"October 3, 2022 5:06 AM (UTC)",,
Open Access Journals Search Engine (OAJSE) : Social Sciences,,https://oajse.com/subjects/social_sciences.html,BOOKMRKS-MTHRFCKR / REFERENCE-MTHRFCKR / Academic / Academic and Grey Literature Research Tools,academic,"October 3, 2022 5:06 AM (UTC)",,
A-Z Databases,,https://guides.uflib.ufl.edu/az.php,BOOKMRKS-MTHRFCKR / REFERENCE-MTHRFCKR / Academic / Academic and Grey Literature Research Tools,academic,"October 3, 2022 5:06 AM (UTC)",,
Greylitstrategies.info,,https://greylitstrategies.info,BOOKMRKS-MTHRFCKR / REFERENCE-MTHRFCKR / Academic / Academic and Grey Literature Research Tools,academic,"October 3, 2022 5:06 AM (UTC)",,
Greyguide.isti.cnr.it,Repository and Portal to Good Practices and Resources in Grey Literature,https://greyguide.isti.cnr.it,BOOKMRKS-MTHRFCKR / REFERENCE-MTHRFCKR / Academic / Academic and Grey Literature Research Tools,academic,"October 3, 2022 5:06 AM (UTC)",,
Get The Research,,https://gettheresearch.org,BOOKMRKS-MTHRFCKR / REFERENCE-MTHRFCKR / Academic / Academic and Grey Literature Research Tools,academic,"October 3, 2022 5:06 AM (UTC)",,
Europe PMC,Europe PMC is an archive of life sciences journal literature.,https://europepmc.org,BOOKMRKS-MTHRFCKR / REFERENCE-MTHRFCKR / Academic / Academic and Grey Literature Research Tools,academic,"October 3, 2022 5:06 AM (UTC)",,
Dissertation.com,,https://dissertation.com,BOOKMRKS-MTHRFCKR / REFERENCE-MTHRFCKR / Academic / Academic and Grey Literature Research Tools,academic,"October 3, 2022 5:06 AM (UTC)",,
Research Guides: Gray Literature: Gray Literature,"Grey Literature, Preprints, E-prints, Technical Reports",https://csulb.libguides.com/graylit,BOOKMRKS-MTHRFCKR / REFERENCE-MTHRFCKR / Academic / Academic and Grey Literature Research Tools,academic,"October 3, 2022 5:06 AM (UTC)",,
citeseer.ist.psu.edu/,"Scientific Literature Digital Library incorporating autonomous citation indexing, awareness and tracking, citation context, related document retrieval, similar document identification, citation graph analysis, and query-sensitive document summaries. Advantages in terms of availability, coverage, timeliness, and efficiency. Isaac Councill and C. Lee Giles.",https://citeseer.ist.psu.edu,BOOKMRKS-MTHRFCKR / REFERENCE-MTHRFCKR / Academic / Academic and Grey Literature Research Tools,academic,"October 3, 2022 5:06 AM (UTC)",,
ASCE Library,"ASCE Library is your platform for the latest in civil engineering practice and research. This core collection covers all areas of civil engineering including structures, geotechnics, environment and water resources, construction, transportation and urban development, coasts, oceans, ports, and rivers, architecture, and engineering mechanics. ASCE’s scholarly publications include books, peer-reviewed journals, conference proceedings, and magazines.",https://ascelibrary.org,BOOKMRKS-MTHRFCKR / REFERENCE-MTHRFCKR / Academic / Academic and Grey Literature Research Tools,academic,"October 3, 2022 5:06 AM (UTC)",,
Abbreviations and Acronyms,Abbreviations and acronyms explained.,https://abbreviations.yourdictionary.com,BOOKMRKS-MTHRFCKR / REFERENCE-MTHRFCKR / Acronyms and Abbreviations,Acronyms,"October 3, 2022 5:06 AM (UTC)",,
TheFreeDictionary.com,"Abbreviations - acronyms and initialisms from a database of over 1,000,000 entries covering computers, technology, telecommunications, and the military.",https://acronyms.thefreedictionary.com,BOOKMRKS-MTHRFCKR / REFERENCE-MTHRFCKR / Acronyms and Abbreviations,Acronyms,"October 3, 2022 5:06 AM (UTC)",http://img.tfd.com/TFDlogo1200x1200.png,
Acronyms.silmaril.ie,,https://acronyms.silmaril.ie,BOOKMRKS-MTHRFCKR / REFERENCE-MTHRFCKR / Acronyms and Abbreviations,Acronyms,"October 3, 2022 5:06 AM (UTC)",,
Pediatric Neurology Briefs,Article: Long-Term Effects of Adderall XR in ADHD,https://www.pediatricneurologybriefs.com/article/10.15844/pedneurbriefs-19-6-10,BOOKMRKS-MTHRFCKR / REFERENCE-MTHRFCKR / Adderall,adderall,"September 14, 2022 12:02 PM (UTC)",,
Efficacy of modafinil compared to dextroamphetamine for the treatment of attention deficit hyperactivity disorder in adults - PubMed,"Our objective was to compare the efficacy of the new wake-promoting drug modafinil to that of dextroamphetamine for the treatment of attention deficit hyperactivity disorder (ADHD) in adults. Twenty-two adults who met DSM-IV criteria for ADHD participated in a randomized, double-blind, placebo-contr …",https://pubmed.ncbi.nlm.nih.gov/11191692,BOOKMRKS-MTHRFCKR / REFERENCE-MTHRFCKR / Adderall,adderall,"September 14, 2022 12:03 PM (UTC)",https://cdn.ncbi.nlm.nih.gov/pubmed/persistent/pubmed-meta-image.png,
Methamphetamine and the expanding complications of amphetamines - PubMed,"During the past 10 years, the use of methamphetamine has increased rapidly in the West and throughout the United States. Because of this increase, our attention has focused on methamphetamine's toxicity. Methamphetamine and related compounds generate many of the same toxic effects as cocaine. Becaus …",https://pubmed.ncbi.nlm.nih.gov/10344175,BOOKMRKS-MTHRFCKR / REFERENCE-MTHRFCKR / Adderall,adderall,"September 14, 2022 12:04 PM (UTC)",https://cdn.ncbi.nlm.nih.gov/pubmed/persistent/pubmed-meta-image.png,
Efficacy and safety of dexmethylphenidate extended-release capsules in adults with attention-deficit/hyperactivity disorder - PubMed,"Once-daily d-MPH-ER at 20 mg, 30 mg, or 40 mg is a safe and effective treatment for adults with ADHD.",https://pubmed.ncbi.nlm.nih.gov/17137560,BOOKMRKS-MTHRFCKR / REFERENCE-MTHRFCKR / Adderall,adderall,"September 14, 2022 12:16 PM (UTC)",https://cdn.ncbi.nlm.nih.gov/pubmed/persistent/pubmed-meta-image.png,
Toxicity of amphetamines: an update - PubMed,"Amphetamines represent a class of psychotropic compounds, widely abused for their stimulant, euphoric, anorectic, and, in some cases, emphathogenic, entactogenic, and hallucinogenic properties. These compounds derive from the β-phenylethylamine core structure and are kinetically and dynamically char …",https://pubmed.ncbi.nlm.nih.gov/22392347,BOOKMRKS-MTHRFCKR / REFERENCE-MTHRFCKR / Adderall,adderall,"September 14, 2022 12:17 PM (UTC)",https://cdn.ncbi.nlm.nih.gov/pubmed/persistent/pubmed-meta-image.png,
Methamphetamine neurotoxicity: necrotic and apoptotic mechanisms and relevance to human abuse and treatment - PubMed,"Research into methamphetamine-induced neurotoxicity has experienced a resurgence in recent years. This is due to (1) greater understanding of the mechanisms underlying methamphetamine neurotoxicity, (2) its usefulness as a model for Parkinson's disease and (3) an increased abuse of the substance, es …",https://pubmed.ncbi.nlm.nih.gov/11516769,BOOKMRKS-MTHRFCKR / REFERENCE-MTHRFCKR / Adderall,adderall,"September 14, 2022 12:18 PM (UTC)",https://cdn.ncbi.nlm.nih.gov/pubmed/persistent/pubmed-meta-image.png,
Amphetamine increases errors during episodic memory retrieval - PubMed,"Moderate doses of stimulant drugs are known to enhance memory encoding and consolidation, but their effects on memory retrieval have not been explored in depth. In laboratory animals, stimulants seem to improve retrieval of emotional memories, but comparable studies have not been carried out in huma …",https://pubmed.ncbi.nlm.nih.gov/24135845,BOOKMRKS-MTHRFCKR / REFERENCE-MTHRFCKR / Adderall,adderall,"September 14, 2022 12:19 PM (UTC)",https://cdn.ncbi.nlm.nih.gov/pubmed/persistent/pubmed-meta-image.png,
A randomized double-blind trial of paroxetine and/or dextroamphetamine and problem-focused therapy for attention-deficit/hyperactivity disorder in adults - PubMed,"ADHD symptoms improved with dextroamphetamine. Mood and internalizing symptoms were seen as improved with paroxetine by clinicians, despite absence of response on the HAM-A and HAM-D. The presence of a lifetime internalizing disorder attenuated the response to dextroamphetamine. Patients who receive …",https://pubmed.ncbi.nlm.nih.gov/16669726,BOOKMRKS-MTHRFCKR / REFERENCE-MTHRFCKR / Adderall,adderall,"September 14, 2022 12:20 PM (UTC)",https://cdn.ncbi.nlm.nih.gov/pubmed/persistent/pubmed-meta-image.png,
Amph,,https://cdn.preterhuman.net/texts/drugs/amph.fun,BOOKMRKS-MTHRFCKR / REFERENCE-MTHRFCKR / Adderall,adderall,"September 14, 2022 1:26 PM (UTC)",,
Amphetam,,https://cdn.preterhuman.net/texts/drugs/amphetam,BOOKMRKS-MTHRFCKR / REFERENCE-MTHRFCKR / Adderall,adderall,"September 14, 2022 1:28 PM (UTC)",,
Monomethylation Of Amphetamines To Methamphetamine [en5k789gy5no],Monomethylation Of Amphetamines To Methamphetamine [en5k789gy5no]. ...,https://idoc.pub/documents/monomethylation-of-amphetamines-to-methamphetamine-en5k789gy5no,BOOKMRKS-MTHRFCKR / REFERENCE-MTHRFCKR / Adderall,adderall,"September 14, 2022 1:37 PM (UTC)",https://idoc.pub/img/detail/en5k789gy5no.jpg,
Amphetamine Synthese [nk0p3y7gj1q1],Amphetamine Synthese [nk0p3y7gj1q1]. ...,https://doku.pub/documents/amphetamine-synthese-nk0p3y7gj1q1,BOOKMRKS-MTHRFCKR / REFERENCE-MTHRFCKR / Adderall,adderall,"September 14, 2022 1:48 PM (UTC)",https://doku.pub/img/detail/nk0p3y7gj1q1.jpg,
Further evidence that amphetamines produce long-lasting dopamine neurochemical deficits by destroying dopamine nerve fibers,,https://linkinghub.elsevier.com/retrieve/pii/0006899384912216,BOOKMRKS-MTHRFCKR / REFERENCE-MTHRFCKR / Adderall,adderall,"September 14, 2022 5:14 PM (UTC)",https://ars.els-cdn.com/content/image/1-s2.0-S0006899300X15284-cov150h.gif,
Enhancement stimulants: perceived motivational and cognitive advantages,,http://journal.frontiersin.org/article/10.3389/fnins.2013.00198/abstract,BOOKMRKS-MTHRFCKR / REFERENCE-MTHRFCKR / Adderall,adderall,"September 14, 2022 5:14 PM (UTC)",https://www.frontiersin.org/files/MyHome%20Article%20Library/62248/62248_Thumb_400.jpg,
Efficacy of Modafinil Compared to Dextroamphetamine for the Treatment of Attention Deficit Hyperactivity Disorder in Adults,,http://www.liebertpub.com/doi/10.1089/cap.2000.10.311,BOOKMRKS-MTHRFCKR / REFERENCE-MTHRFCKR / Adderall,adderall,"September 14, 2022 5:14 PM (UTC)",https://www.liebertpub.com/action/showCoverImage?journalCode=,
Efficacy of a Mixed Amphetamine Salts Compound in Adults With Attention-Deficit/Hyperactivity Disorder,,http://archpsyc.jamanetwork.com/article.aspx?doi=10.1001%2Farchpsyc.58.8.775,BOOKMRKS-MTHRFCKR / REFERENCE-MTHRFCKR / Adderall,adderall,"September 14, 2022 5:14 PM (UTC)",https://cdn.jamanetwork.com/ama/content_public/journal/psych/5117/yoa9442t1.png?Expires=2147483647&Signature=MEEFPpFUQTQXyQCMAGEG~HdgYfZ9nN9LsDT9grG57-cGr6MoMsM9mwBHwNjhnudXN5JjxMSTUsjRPL5hLF5hWTTRNeiYz2-zeeobDKzwoYu5uUWBKIMRVNGX1eUnpJuoE5aOrAIAkNPQdUm54QKfS5eA2QjbUireW5JWHvtdpoMe4B~G57ksa4rUPeGDb5ht5myERFLggt3JFNATc0Dx0sLG9IEeJ7P2b8SBGqcdB8~BoKc20xzCNOdEIoNSNFU-wFOTrX6~Phpd4Q9qtPAiXcUpHYQt~yWrN39LHdcC693D9ucBnEVPrEhOkSCzWFCIMBqEzFd7mtshytnl-FAWdQ__&Key-Pair-Id=APKAIE5G5CRDK6RD3PGA,
Efficacy and Safety of Dexmethylphenidate Extended-Release Capsules in Adults with Attention-Deficit/Hyperactivity Disorder,,https://linkinghub.elsevier.com/retrieve/pii/S0006322306009541,BOOKMRKS-MTHRFCKR / REFERENCE-MTHRFCKR / Adderall,adderall,"September 14, 2022 5:14 PM (UTC)",https://ars.els-cdn.com/content/image/1-s2.0-S0006322307X05717-cov150h.gif,
Effectiveness and Tolerability of Tomoxetine in Adults With Attention Deficit Hyperactivity Disorder,,http://psychiatryonline.org/doi/abs/10.1176/ajp.155.5.693,BOOKMRKS-MTHRFCKR / REFERENCE-MTHRFCKR / Adderall,adderall,"September 14, 2022 5:14 PM (UTC)",,
"DARK Side of Amphetamine and Analogues: Pharmacology, Syndromic Manifestation, and Management of Amphetamine Addiction",,https://pubs.acs.org/doi/10.1021/acschemneuro.8b00137,BOOKMRKS-MTHRFCKR / REFERENCE-MTHRFCKR / Adderall,adderall,"September 14, 2022 5:14 PM (UTC)",,
An extrapyramidal choreiform syndrome caused by amphetamine addiction,,https://jnnp.bmj.com/lookup/doi/10.1136/jnnp.44.8.728,BOOKMRKS-MTHRFCKR / REFERENCE-MTHRFCKR / Adderall,adderall,"September 14, 2022 5:14 PM (UTC)",https://jnnp.bmj.com/sites/default/files/highwire/jnnp/44/8.cover.gif,
Amphetamines induce apoptosis and regulation of bcl‐x splice variants in neocortical neurons,,https://onlinelibrary.wiley.com/doi/abs/10.1096/fasebj.13.9.1065,BOOKMRKS-MTHRFCKR / REFERENCE-MTHRFCKR / Adderall,adderall,"September 14, 2022 5:14 PM (UTC)",,
Amphetamines: A Dangerous Illusion,,http://annals.org/article.aspx?doi=10.7326%2F0003-4819-74-4-605,BOOKMRKS-MTHRFCKR / REFERENCE-MTHRFCKR / Adderall,adderall,"September 14, 2022 5:14 PM (UTC)",https://www.acpjournals.org/na101/home/literatum/publisher/acp/journals/covergifs/aim/cover.png,
"Amphetamine, past and present – a pharmacological and clinical perspective",,http://journals.sagepub.com/doi/10.1177/0269881113482532,BOOKMRKS-MTHRFCKR / REFERENCE-MTHRFCKR / Adderall,adderall,"September 14, 2022 5:14 PM (UTC)",,
Amphetamine Increases Errors During Episodic Memory Retrieval,,https://journals.lww.com/00004714-201402000-00016,BOOKMRKS-MTHRFCKR / REFERENCE-MTHRFCKR / Adderall,adderall,"September 14, 2022 5:14 PM (UTC)",https://images.journals.lww.com/psychopharmacology/SocialThumb.00004714-201402000-00016.T1-16.jpeg,
Amphetamine designer drugs – an overview and epidemiology,,https://linkinghub.elsevier.com/retrieve/pii/S0378427499002052,BOOKMRKS-MTHRFCKR / REFERENCE-MTHRFCKR / Adderall,adderall,"September 14, 2022 5:14 PM (UTC)",https://ars.els-cdn.com/content/image/1-s2.0-S0378427422X00167-cov150h.gif,
Adult ADHD Medications and Their Cardiovascular Implications,,http://www.hindawi.com/journals/cric/2016/2343691,BOOKMRKS-MTHRFCKR / REFERENCE-MTHRFCKR / Adderall,adderall,"September 14, 2022 5:14 PM (UTC)",https://images.hindawi.com/journals/cric/cric.banner.jpg,
