title,description,url,folder,tags,created,cover,highlights
"SpanishDict | English to Spanish Translation, Dictionary, Translator","SpanishDict is the world's largest online Spanish-English dictionary, translator, and reference tool.",https://www.spanishdict.com,BOOKMRKS-MTHRFCKR / REFERENCE-MTHRFCKR / Grammer / Spelling / Etc,"abbreviations, etc","September 14, 2022 12:31 PM (UTC)",https://d1q4kshf6f0axi.cloudfront.net/img/common/logo-square-medium.png,
Synonym.com,Find synonyms and antonyms for words,https://www.synonym.com,BOOKMRKS-MTHRFCKR / REFERENCE-MTHRFCKR / Grammer / Spelling / Etc,"abbreviations, etc","September 14, 2022 12:31 PM (UTC)",https://www.synonym.com/public/images/synonym-logo.jpg,
The Idioms - Largest Idiom Dictionary,"TheIdioms.com website has a large collection of the most famous and popular English idioms, explained by expert authors and teachers in a very comprehensive way. Each idiom comes with several different examples, meaning and origin.",https://www.theidioms.com,BOOKMRKS-MTHRFCKR / REFERENCE-MTHRFCKR / Grammer / Spelling / Etc,"abbreviations, etc","September 14, 2022 12:31 PM (UTC)",https://idioms.a2hosted.com/image.png/?=45,
"Urban Dictionary, September 14: wooden onesie","Short for ""traditional wife."" Used in alt-right circles to refer to women that embody traditionally feminine and wifely qualities (submissiveness, chastity, willingness to do household chores, etc).",https://www.urbandictionary.com,BOOKMRKS-MTHRFCKR / REFERENCE-MTHRFCKR / Grammer / Spelling / Etc,"abbreviations, etc","September 14, 2022 12:31 PM (UTC)",,
Visualizing SEP: An interactive data visualization of the Stanford Encyclopedia of Philosophy,,https://www.visualizingsep.com,BOOKMRKS-MTHRFCKR / REFERENCE-MTHRFCKR / Grammer / Spelling / Etc,"abbreviations, etc","September 14, 2022 12:31 PM (UTC)",,
Describing Words - Find Adjectives to Describe Things,,https://describingwords.io,BOOKMRKS-MTHRFCKR / REFERENCE-MTHRFCKR / Grammer / Spelling / Etc,"abbreviations, etc","September 14, 2022 12:31 PM (UTC)",,
The Dictionary of Obscure Sorrows,,https://www.dictionaryofobscuresorrows.com,BOOKMRKS-MTHRFCKR / REFERENCE-MTHRFCKR / Grammer / Spelling / Etc,"abbreviations, etc","September 14, 2022 12:31 PM (UTC)",https://64.media.tumblr.com/1a67d05edbc1d550d7973b69918c814f/18163b1cf2447bc9-ba/s128x128u_c1/868f59bf6ad1f913377823fe620d00f34e309ebf.jpg,
Just a moment...,,https://www.encyclopedia.com,BOOKMRKS-MTHRFCKR / REFERENCE-MTHRFCKR / Grammer / Spelling / Etc,"abbreviations, etc","September 14, 2022 12:31 PM (UTC)",,
Etymonline - Online Etymology Dictionary,"The online etymology dictionary (etymonline) is the internet's go-to source for quick and reliable accounts of the origin and history of English words, phrases, and idioms. It is professional enough to satisfy academic standards, but accessible enough to be used by anyone.",https://www.etymonline.com,BOOKMRKS-MTHRFCKR / REFERENCE-MTHRFCKR / Grammer / Spelling / Etc,"abbreviations, etc","September 14, 2022 12:31 PM (UTC)",,
Fandom,"The entertainment site where fans come first. Your daily source for all things TV, movies, and games, including Star Wars, Fallout, Marvel, DC and more.",https://www.fandom.com,BOOKMRKS-MTHRFCKR / REFERENCE-MTHRFCKR / Grammer / Spelling / Etc,"abbreviations, etc","September 14, 2022 12:31 PM (UTC)",https://static.wikia.nocookie.net/750feb85-de88-4a4f-b294-8b48142ac182/thumbnail-down/width/1280/height/720,
Sign Language • ASL | HandSpeak®,"Sign Language online contains the ASL dictionary, tutorials, grammar, sentences, alphabet, Deaf culture, baby signing, and more.",https://www.handspeak.com,BOOKMRKS-MTHRFCKR / REFERENCE-MTHRFCKR / Grammer / Spelling / Etc,"abbreviations, etc","September 14, 2022 12:31 PM (UTC)",,
"Infoplease: An Online Encyclopedia, Almanac, Atlas, Biographies, Dictionary, and Thesaurus","Infoplease is a free, authoritative, and respected reference for Internet users that provides a comprehensive encyclopedia, almanac, atlas, dictionary, and thesaurus.",https://www.infoplease.com,BOOKMRKS-MTHRFCKR / REFERENCE-MTHRFCKR / Grammer / Spelling / Etc,"abbreviations, etc","September 14, 2022 12:31 PM (UTC)",https://www.infoplease.com/themes/ip/images/og_logo_pos.jpg,
Longman Dictionary of Contemporary English | LDOCE,"Longman English Dictionary - the leading dictionary for learners of English of all levels: definitions, idioms, examples and more.",https://www.ldoceonline.com,BOOKMRKS-MTHRFCKR / REFERENCE-MTHRFCKR / Grammer / Spelling / Etc,"abbreviations, etc","September 14, 2022 12:31 PM (UTC)",,
Dictionary.com | Meanings and Definitions of Words at Dictionary.com,"Dictionary.com is the world’s leading online source for English definitions, pronunciations, word origins, idioms, Word of the Day, and more.",https://www.dictionary.com,BOOKMRKS-MTHRFCKR / REFERENCE-MTHRFCKR / Grammer / Spelling / Etc,"abbreviations, etc","September 14, 2022 12:31 PM (UTC)",,
"Lexicool | Dictionaries, translation and language resources","Over 8000 online bilingual and multilingual dictionaries, free automatic translation and other useful language resources.",https://www.lexicool.com,BOOKMRKS-MTHRFCKR / REFERENCE-MTHRFCKR / Grammer / Spelling / Etc,"abbreviations, etc","September 14, 2022 12:31 PM (UTC)",https://www.lexicool.com/lexicool-logo3.jpg,
LEXILOGOS Online dictionaries - Languages & Countries,"Free online dictionaries in every language, maps and documents of every country",https://www.lexilogos.com/english/index.htm,BOOKMRKS-MTHRFCKR / REFERENCE-MTHRFCKR / Grammer / Spelling / Etc,"abbreviations, etc","September 14, 2022 12:31 PM (UTC)",https://www.lexilogos.com/images/babel_bruegel.jpg,
www.lingo2word.com,"Put fun into mobile phone messages, Find new funny Txt messages, translate, Understand texting language",https://www.lingo2word.com,BOOKMRKS-MTHRFCKR / REFERENCE-MTHRFCKR / Grammer / Spelling / Etc,"abbreviations, etc","September 14, 2022 12:31 PM (UTC)",,
Macmillan Dictionary | Free English Dictionary and Thesaurus,"The Free Online English Dictionary from Macmillan Education. Definitions, meanings, synonyms, pronunciations, games, sound effects, high-quality images, idioms and metaphors, resources for teachers and students",https://www.macmillandictionary.com,BOOKMRKS-MTHRFCKR / REFERENCE-MTHRFCKR / Grammer / Spelling / Etc,"abbreviations, etc","September 14, 2022 12:31 PM (UTC)",https://www.macmillandictionary.com/external/images/social/social_macmillan.jpg?version=4.0.70,
"Thinkmap Visual Thesaurus - An online thesaurus and dictionary of over 145,000 words that you explore using an interactive map.","An online thesaurus and dictionary of over 145,000 words that you explore using an interactive map.  It's a tool for people who think visually.  The most fun you've ever had with words. The Visual Thesaurus was built using Thinkmap, a data visualization technology.",https://www.visualthesaurus.com,BOOKMRKS-MTHRFCKR / REFERENCE-MTHRFCKR / Grammer / Spelling / Etc,"abbreviations, etc","September 14, 2022 12:32 PM (UTC)",,
Vocabulary.com - Learn Words - English Dictionary,,https://www.vocabulary.com,BOOKMRKS-MTHRFCKR / REFERENCE-MTHRFCKR / Grammer / Spelling / Etc,"abbreviations, etc","September 14, 2022 12:32 PM (UTC)",https://www.vocabulary.com/images/icons/facebook-75x75.gif,
"Webopedia: IT & Computer Dictionary, Study Guides & Reviews",Webopedia is the most comprehensive information technology reference. Read computer definitions and study guides now.,https://www.webopedia.com,BOOKMRKS-MTHRFCKR / REFERENCE-MTHRFCKR / Grammer / Spelling / Etc,"abbreviations, etc","September 14, 2022 12:32 PM (UTC)",,
Wikipedia,"Wikipedia is a free online encyclopedia, created and edited by volunteers around the world and hosted by the Wikimedia Foundation.",https://www.wikipedia.org,BOOKMRKS-MTHRFCKR / REFERENCE-MTHRFCKR / Grammer / Spelling / Etc,"abbreviations, etc","September 14, 2022 12:32 PM (UTC)",,
Wikiwand,Wikiwand is the world's leading Wikipedia reader for web and mobile.,https://www.wikiwand.com,BOOKMRKS-MTHRFCKR / REFERENCE-MTHRFCKR / Grammer / Spelling / Etc,"abbreviations, etc","September 14, 2022 12:32 PM (UTC)",https://assets.wikiwand.com/img/wikipedia_to_wikiwand2.jpg,
Wiktionary,,https://www.wiktionary.org,BOOKMRKS-MTHRFCKR / REFERENCE-MTHRFCKR / Grammer / Spelling / Etc,"abbreviations, etc","September 14, 2022 12:32 PM (UTC)",,
Wolfram|Alpha: Computational Intelligence,Wolfram|Alpha brings expert-level knowledge and capabilities to the broadest possible range of people—spanning all professions and education levels.,https://www.wolframalpha.com,BOOKMRKS-MTHRFCKR / REFERENCE-MTHRFCKR / Grammer / Spelling / Etc,"abbreviations, etc","September 14, 2022 12:32 PM (UTC)",https://www.wolframalpha.com/_next/static/images/share_3eSzXbxb.png,
Wordnik,All the words,https://www.wordnik.com,BOOKMRKS-MTHRFCKR / REFERENCE-MTHRFCKR / Grammer / Spelling / Etc,"abbreviations, etc","September 14, 2022 12:32 PM (UTC)",https://www.wordnik.com/img/wordnik-logo-300px.png,
"English to French, Italian, German & Spanish Dictionary - WordReference.com",,https://www.wordreference.com,BOOKMRKS-MTHRFCKR / REFERENCE-MTHRFCKR / Grammer / Spelling / Etc,"abbreviations, etc","September 14, 2022 12:32 PM (UTC)",,
"WordSense Dictionary: word origin & history, definitions, synonyms & translations",,https://www.wordsense.eu,BOOKMRKS-MTHRFCKR / REFERENCE-MTHRFCKR / Grammer / Spelling / Etc,"abbreviations, etc","September 14, 2022 12:32 PM (UTC)",,
"Search results for ""%s"" - Wiktionary",,https://en.wiktionary.org/wiki/Special:Search?go=Go&search=%25s,BOOKMRKS-MTHRFCKR / REFERENCE-MTHRFCKR / Grammer / Spelling / Etc,"abbreviations, etc","March 16, 2022 2:13 AM (UTC)",,
Where to Find Historical Newspapers Online for each US State,Browse the actual pages of hundreds of digitized historical newspapers online in this list organized by state.,https://www.thoughtco.com/us-historical-newspapers-online-by-state-1422215,BOOKMRKS-MTHRFCKR / REFERENCE-MTHRFCKR / Newspaper Sites,newspaper sites,"September 14, 2022 12:49 PM (UTC)",https://www.thoughtco.com/thmb/Y3vYN3pAW0S0M_w6tkZtoUa0uwc=/1500x0/filters:no_upscale():max_bytes(150000):strip_icc()/getty-old-newspapers-58b9d0863df78c353c38b7f7.jpg,
https://www.thepaperboy.com/,,https://www.thepaperboy.com,BOOKMRKS-MTHRFCKR / REFERENCE-MTHRFCKR / Newspaper Sites,newspaper sites,"September 14, 2022 12:49 PM (UTC)",,
storage - freemediaheckyeah,r/FREEMEDIAHECKYEAH: 🍿 📺 🎵 🎮 📗 📱,https://www.reddit.com/r/freemediaheckyeah/wiki/storage#wiki_worldwide_news_sites_index,BOOKMRKS-MTHRFCKR / REFERENCE-MTHRFCKR / Newspaper Sites,newspaper sites,"September 14, 2022 12:49 PM (UTC)",,
"Newspaper Archives/Indexes/Morgues - Newspaper and Current Periodical Reading Room (Serial and Government Publications Division, Library of Congress)","Newspaper Archives, Indexes & Morgues (Newspaper and Current Periodical Reading Room, Library of Congress).",https://www.loc.gov/rr/news/oltitles.html,BOOKMRKS-MTHRFCKR / REFERENCE-MTHRFCKR / Newspaper Sites,newspaper sites,"September 14, 2022 12:49 PM (UTC)",,
Newspapers,"Explore the headlines, articles, advertisements, and opinion pieces from European newspapers from 20 countries, dating from 1618 to the 1980s.",https://www.europeana.eu/en/collections/topic/18-newspapers,BOOKMRKS-MTHRFCKR / REFERENCE-MTHRFCKR / Newspaper Sites,newspaper sites,"September 14, 2022 12:49 PM (UTC)",,
https://www.elephind.com/,,https://www.elephind.com,BOOKMRKS-MTHRFCKR / REFERENCE-MTHRFCKR / Newspaper Sites,newspaper sites,"September 14, 2022 12:49 PM (UTC)",,
World Newspapers and Magazines on your Finger Tip | World-Newspapers.com,"Annotated directory of newspapers, magazines and news sites in English.",https://world-newspapers.com,BOOKMRKS-MTHRFCKR / REFERENCE-MTHRFCKR / Newspaper Sites,newspaper sites,"September 14, 2022 12:49 PM (UTC)",,
Газеты на английском/Newspapers English / FR /DE,"📰 Газеты и журналы на английском, немецком, франзуском и др. языках 🌎 НАШ ТЕЛЕГРАМ КАНАЛ - t.me/itsallinenglish Ребята, часть журналов и газет мы вынуждены перенести на наш телеграм канал - t.me/itsallinenglish Спасибо, что остаетесь с нами все эти годы и будем рады видеть вас и в нашем филиале в..",https://vk.com/engnewspapers,BOOKMRKS-MTHRFCKR / REFERENCE-MTHRFCKR / Newspaper Sites,newspaper sites,"September 14, 2022 12:49 PM (UTC)","http://sun9-34.userapi.com/s/v1/if1/Rq9zVhyvDcqf1JcCE47C3esPxwfggs74EHFlOAOEjM51sudqeNlNpGBxnmGs6tN2CkH1_8Ef.jpg?size=200x300&quality=96&crop=0,0,500,750&ava=1",
Archive of newspapers & magazines,Newspapers:	- Wall Street Journal	- Financial Times	- New York Times		Magazines:	- The #Economist	- #Forbes_RU	- #Forbes_ASIA	- #Forbes_US	- #RBK	- #BLOOMBERG BW	- #BARRON’S	- #FORTUNE	- #HARVARD BR,https://t.me/newspaper_archive,BOOKMRKS-MTHRFCKR / REFERENCE-MTHRFCKR / Newspaper Sites,newspaper sites,"September 14, 2022 12:49 PM (UTC)",https://cdn4.telegram-cdn.org/file/JUO3Wk0y3ODAhZYQEjPZ9UQZ0oPnbNQa1eZsoA13r_yP6sefmt8EFtNoqmNc6TuNrDsadGCOX8GLHKGXDRs7skKy6zxzIFwWGCHlpHKjL479HJIZth1gj2FvjpO6QCCPxxGvqz0vCficAugl9MkR4XJ3nz3O_sXU3ngqjK7EqN4XDtUIz-gwxewE0zBge-LJloLxZnnmv0KLjDZIkwu0Mt0NqC8Cmz-8Enf5yvZKdjfwe270YSfv4ZDc5xUFpuzo-H9cT4c62w5c7ioYCk2i7gFXQhFQ7J98RN8IAoyJF5BQdxCx5ouKTCnw3uGimg0Mwoy5qD0nuZHje4oPkjVaew.jpg,
BookCrush Newsstand Bot,Posts newspapers and magazines automatically to @BookCrushNewsstand channel and in your pm or groups,https://t.me/bookcrushnewsstandbot,BOOKMRKS-MTHRFCKR / REFERENCE-MTHRFCKR / Newspaper Sites,newspaper sites,"September 14, 2022 12:49 PM (UTC)",https://cdn4.telegram-cdn.org/file/pfv8ePtl-fnHUwwysIPGN9tBM6p9IdF7lC-TbJLjIl3bzkWFete9GzHJvE7nOsdyXYgeShOf_NvodKvcq-qrElptQSpF6rwLUmF-hAyNAIC9j2LSWJkZNxLNa9qQapHdFRg0WdTa3UzgsNbYxOegZS0qxpms6hosCUwyTvtVDF0Dh_REBs_l2avYzbtM3BSvEJ5b8y0QCtZ3Dv_LrHRb44-jyawx29XLSVZsgIOa7COqj8bzOju7ZErsYSMj_Fqr-inNrDgcU7WEYcNMFgZlDvq53i5w-3zntjR3vngNP0xSr1MvbrACPgsbOPVwtXI04GTxs1lvKc9mhlDgtjzd7Q.jpg,
BookCrush: Newsstand,"Newspapers, Magazines & Comics by @BookCrush	⚡️ @BookCrushNewsstandBot		Read this post to know how this channel and the bot works 👇	https://bit.ly/WhatsNewsstand		🆕 Join @FinCrush		🧑‍💻 Support: @BookCrushContactBot		📪 Backup: @BookCrushNewsstand2",https://t.me/bookcrushnewsstand,BOOKMRKS-MTHRFCKR / REFERENCE-MTHRFCKR / Newspaper Sites,newspaper sites,"September 14, 2022 12:49 PM (UTC)",,
https://sanet.st/newspapers/,,https://sanet.st/newspapers,BOOKMRKS-MTHRFCKR / REFERENCE-MTHRFCKR / Newspaper Sites,newspaper sites,"September 14, 2022 12:49 PM (UTC)",,
Historical Newspapers from 1700s-2000s,"The largest online newspaper archive, established in 2012. Used by millions every month for genealogy and family history, historical research, crime investigations, journalism, and entertainment. Search for obituaries, marriage announcements, birth announcements, social pages, national and local news articles, sports, advertisements, entertainment, fashion and lifestyle pages, comics, and more.",https://newspapers.com,BOOKMRKS-MTHRFCKR / REFERENCE-MTHRFCKR / Newspaper Sites,newspaper sites,"September 14, 2022 12:49 PM (UTC)",https://www.newspapers.com/i/papergroup-fsnp.png,
Newspaper Map,Find and translate all newspapers in the world,https://newspapermap.com,BOOKMRKS-MTHRFCKR / REFERENCE-MTHRFCKR / Newspaper Sites,newspaper sites,"September 14, 2022 12:49 PM (UTC)",https://newspapermap.com/images/og-image.jpg,
Google News Archive Search,,https://news.google.com/newspapers,BOOKMRKS-MTHRFCKR / REFERENCE-MTHRFCKR / Newspaper Sites,newspaper sites,"September 14, 2022 12:49 PM (UTC)",,
Los Angeles Times archive from 1881-2022,"The largest online newspaper archive, established in 2012. Used by millions every month for genealogy and family history, historical research, crime investigations, journalism, and entertainment. Search for obituaries, marriage announcements, birth announcements, social pages, national and local news articles, sports, advertisements, entertainment, fashion and lifestyle pages, comics, and more.",https://latimes.newspapers.com,BOOKMRKS-MTHRFCKR / REFERENCE-MTHRFCKR / Newspaper Sites,newspaper sites,"September 14, 2022 12:49 PM (UTC)",https://latimes.newspapers.com/i/papergroup-fsnp.png,
"GitHub - akshay2211/NYTimes-Compose: An offline-first application in Jetpack Compose with MVVM architecture, representing a minimalistic implementation of Top Stories API.","An offline-first application in Jetpack Compose with MVVM architecture, representing a minimalistic implementation of Top Stories API. - GitHub - akshay2211/NYTimes-Compose: An offline-first applic...",https://github.com/akshay2211/nytimes-compose,BOOKMRKS-MTHRFCKR / REFERENCE-MTHRFCKR / Newspaper Sites,newspaper sites,"September 14, 2022 12:49 PM (UTC)",https://opengraph.githubassets.com/37ed902f75f86498525cc2de68643099e0e0fb54fa08805f4962e0325dd33b01/akshay2211/NYTimes-Compose,
Magazines & Newspapers | Mobilism,,https://forum.mobilism.org/viewforum.php?f=123,BOOKMRKS-MTHRFCKR / REFERENCE-MTHRFCKR / Newspaper Sites,newspaper sites,"September 14, 2022 12:49 PM (UTC)",,
Chronicling America | Library of Congress,,https://chroniclingamerica.loc.gov/newspapers,BOOKMRKS-MTHRFCKR / REFERENCE-MTHRFCKR / Newspaper Sites,newspaper sites,"September 14, 2022 12:49 PM (UTC)",,
Burlesco - Read news without subscribing,,https://burles.co/en,BOOKMRKS-MTHRFCKR / REFERENCE-MTHRFCKR / Newspaper Sites,newspaper sites,"September 14, 2022 12:49 PM (UTC)",,
http://sanet.st,,http://sanet.st,BOOKMRKS-MTHRFCKR / REFERENCE-MTHRFCKR / Newspaper Sites,newspaper sites,"September 14, 2022 12:49 PM (UTC)",,
"Internet Archive: Digital Library of Free & Borrowable Books, Movies, Music & Wayback Machine","Internet Archive is a non-profit digital library offering free universal access to books, movies & music, as well as 624 billion archived web pages.",http://archive.org,BOOKMRKS-MTHRFCKR / REFERENCE-MTHRFCKR / Newspaper Sites,newspaper sites,"September 14, 2022 12:49 PM (UTC)",,
SJR : Scientific Journal Rankings,,https://www.scimagojr.com/journalrank.php,BOOKMRKS-MTHRFCKR / REFERENCE-MTHRFCKR / Papers and Journals,papers and journals,"September 14, 2022 12:49 PM (UTC)",,
ResearchRabbit,The most powerful discovery app ever built for researchers 🔥,https://www.researchrabbit.ai,BOOKMRKS-MTHRFCKR / REFERENCE-MTHRFCKR / Papers and Journals,papers and journals,"September 14, 2022 12:49 PM (UTC)",http://static1.squarespace.com/static/5dee82c56fcd7b0290640db5/t/5ec5d7e574c928572d67702f/1590024166895/ResearchRabbit+Circular.png?format=1500w,
ResearchGate | Find and share research,Access 130+ million publications and connect with 20+ million researchers. Join for free and gain visibility by uploading your research.,https://www.researchgate.net,BOOKMRKS-MTHRFCKR / REFERENCE-MTHRFCKR / Papers and Journals,papers and journals,"September 14, 2022 12:49 PM (UTC)",,
Litmaps,"Browser-based research platform designed for clarity, comprehensiveness, and collaboration. Create interactive citation graphs of your own research topics.",https://www.litmaps.co,BOOKMRKS-MTHRFCKR / REFERENCE-MTHRFCKR / Papers and Journals,papers and journals,"September 14, 2022 12:49 PM (UTC)",,
Home,,https://www.equator-network.org,BOOKMRKS-MTHRFCKR / REFERENCE-MTHRFCKR / Papers and Journals,papers and journals,"September 14, 2022 12:49 PM (UTC)",,
Built for data miners | Sysrev,Sysrev is a platform for collaborative extraction of data from documents.,https://sysrev.com,BOOKMRKS-MTHRFCKR / REFERENCE-MTHRFCKR / Papers and Journals,papers and journals,"September 14, 2022 12:49 PM (UTC)",,
Papers We Love,A repository of computer science papers and a community of people who love reading them,https://paperswelove.org,BOOKMRKS-MTHRFCKR / REFERENCE-MTHRFCKR / Papers and Journals,papers and journals,"September 14, 2022 12:49 PM (UTC)",https://paperswelove.org/images/papers-we-love-ogp.png,
Publishers,,https://beallslist.net,BOOKMRKS-MTHRFCKR / REFERENCE-MTHRFCKR / Papers and Journals,papers and journals,"September 14, 2022 12:49 PM (UTC)",,
scite: see how research has been cited,scite helps researchers better discover and understand research articles by showing how they have been cited. Researchers can read the context of citation and understand if it provides supporting or contrasting evidence for the cited claim. By searching over 1b Smart Citations researchers can find expert analyses and opinions on all topics.,http://scite.ai,BOOKMRKS-MTHRFCKR / REFERENCE-MTHRFCKR / Papers and Journals,papers and journals,"September 14, 2022 12:49 PM (UTC)",http://image.thum.io/get/ogImage/https://scite.ai?bannerClosed=true,
SciRev - Review the scientific review process,,http://scirev.org,BOOKMRKS-MTHRFCKR / REFERENCE-MTHRFCKR / Papers and Journals,papers and journals,"September 14, 2022 12:49 PM (UTC)",,
Journal / Author Name Estimator,,http://jane.biosemantics.org,BOOKMRKS-MTHRFCKR / REFERENCE-MTHRFCKR / Papers and Journals,papers and journals,"September 14, 2022 12:49 PM (UTC)",,
Eigenfactor: Index of Open Access Fees,Eigenfactor: Cost Effectiveness,http://eigenfactor.org/projects/openAccess/oa.php,BOOKMRKS-MTHRFCKR / REFERENCE-MTHRFCKR / Papers and Journals,papers and journals,"September 14, 2022 12:49 PM (UTC)",,
Preda Qualis,Potentially predatory journals in QUALIS-CAPES,https://predaqualis.netlify.app,BOOKMRKS-MTHRFCKR / REFERENCE-MTHRFCKR / Papers and Journals,papers and journals,"October 1, 2022 7:36 PM (UTC)",,
cb2Bib | MOLspaces,cb2Bib: Bibliographic Reference Extracting and Managing Tool,https://www.molspaces.com/cb2bib,BOOKMRKS-MTHRFCKR / REFERENCE-MTHRFCKR / Papers and Journals,papers and journals,"October 3, 2022 1:06 AM (UTC)",,
Homepage test,Zanran's AI software automatically adds structure to unstructured documents. Zanran converts PDF to XML. Extract tables from PDF. Convert PDF to structured data. Extract text from PDF. Abbyy vs Kofax.,https://zanran.com,BOOKMRKS-MTHRFCKR / REFERENCE-MTHRFCKR / PDF Management,pdf management,"October 3, 2022 5:06 AM (UTC)",,
XpdfReader,,https://www.foolabs.com/xpdf/home.html,BOOKMRKS-MTHRFCKR / REFERENCE-MTHRFCKR / PDF Management,pdf management,"October 3, 2022 5:06 AM (UTC)",,
XODO PDF Reader & Annotator,,https://xodo.com,BOOKMRKS-MTHRFCKR / REFERENCE-MTHRFCKR / PDF Management,pdf management,"October 3, 2022 5:06 AM (UTC)",,
PDFelement | PDF Editor for Business,"Intuitive and easy to use, PDFelement allows businesses to create, convert, collaborate, and edit PDFs with fluidity and interactivity.",https://pdf.wondershare.com/business,BOOKMRKS-MTHRFCKR / REFERENCE-MTHRFCKR / PDF Management,pdf management,"October 3, 2022 5:06 AM (UTC)",,
Tabula.technology.com,Tabula is a free tool for extracting data from PDF files into CSV and Excel files.,https://tabula.technology,BOOKMRKS-MTHRFCKR / REFERENCE-MTHRFCKR / PDF Management,pdf management,"October 3, 2022 5:06 AM (UTC)",,
Smallpdf,"Smallpdf - the platform that makes it super easy to convert and edit all your PDF files. Solving all your PDF problems in one place - and yes, free.",https://smallpdf.com,BOOKMRKS-MTHRFCKR / REFERENCE-MTHRFCKR / PDF Management,pdf management,"October 3, 2022 5:06 AM (UTC)",https://smallpdf.com/assets/img/fb/smallpdf.png,
Easy to use Online PDF editor,"Free, no watermarks or registration. Edit PDF files for free. Fill & sign PDFs. Change existing text and links. Find & replace text. Whiteout. Add text, images, links and annotations.",https://www.sejda.com/pdf-editor,BOOKMRKS-MTHRFCKR / REFERENCE-MTHRFCKR / PDF Management,pdf management,"October 3, 2022 5:06 AM (UTC)",,
pyPdf · PyPI,PDF toolkit,https://pypi.org/project/pyPdf,BOOKMRKS-MTHRFCKR / REFERENCE-MTHRFCKR / PDF Management,pdf management,"October 3, 2022 5:06 AM (UTC)",https://pypi.org/static/images/twitter.6fecba6f.jpg,
Primo PDF,Downloaded by 30+ million users. Get Nitro’s PDF converter and quickly convert to PDF from 300+ file types. PrimoPDF - the 100% free PDF creator!,https://www.primopdf.com,BOOKMRKS-MTHRFCKR / REFERENCE-MTHRFCKR / PDF Management,pdf management,"October 3, 2022 5:06 AM (UTC)",,
PDFx,"PDFx is a tool to extract infos and URLs from a PDF, and to easily download all referenced PDFs",https://www.metachris.com/pdfx,BOOKMRKS-MTHRFCKR / REFERENCE-MTHRFCKR / PDF Management,pdf management,"October 3, 2022 5:06 AM (UTC)",https://www.metachris.com/images/profile2-round.png,
PDF Split And Merge,"A free and open source software to merge, split, rotate and extract pages from PDF files",https://pdfsam.org/download-pdfsam-basic,BOOKMRKS-MTHRFCKR / REFERENCE-MTHRFCKR / PDF Management,pdf management,"October 3, 2022 5:06 AM (UTC)",https://pdfsam.org/imgs/home.png,
firstlookmedia/pdf-redact-tools,a set of tools to help with securely redacting and stripping metadata from documents before publishing - GitHub - firstlookmedia/pdf-redact-tools: a set of tools to help with securely redacting and...,https://github.com/firstlookmedia/pdf-redact-tools,BOOKMRKS-MTHRFCKR / REFERENCE-MTHRFCKR / PDF Management,pdf management,"October 3, 2022 5:06 AM (UTC)",https://opengraph.githubassets.com/6fa2a99bdaadb96875eabaf0c3773a05d686d00d52936a7ae71445188caf96fa/firstlookmedia/pdf-redact-tools,
PDF Expert,"Download a free trial of PDF Expert – the best PDF software for your Mac. Enjoy advanced reading layouts, powerful PDF editing and classical annotation tools.",https://pdfexpert.com,BOOKMRKS-MTHRFCKR / REFERENCE-MTHRFCKR / PDF Management,pdf management,"October 3, 2022 5:06 AM (UTC)",https://d3pbdh1dmixop.cloudfront.net/assets/pdfexpert/20220504/common/share-banner/default.png?1656414890,
